title,company,location,description,redirect_url,salary_min,salary_max,created
Data Scientist,Flint Bishop,"Derby, Derbyshire","Department: Debt Recovery Location: Derby, UK Description Flint Bishop is one of the leading business-to-business debt recovery law firms in the UK. We are the recovery partner for many leading UK brands and the firm has won all three major national debt recovery awards for our strategy and results. Data plays an increasingly important part of our business and as a result of continued growth and further investment within our D&A department, we now have an excellent opportunity for a Data Scient…",https://www.adzuna.co.uk/jobs/details/5107084953?utm_medium=api&utm_source=9b195f40,51825.25,51825.25,2025-03-22T23:08:50Z
BI Data Analyst,BGIS,"Derby, Derbyshire","Position: Business Intelligence & Data Analyst Company: BGIS / BSM Location : South Normanton - Hybrid Type : Full-Time About Us: BGIS is a global facility management company that operates locally in various regions, including the UK bring the best of Global business to local delivery. They provide a range of services such as hard service maintenance, energy management, and workplace solutions. BGIS focuses on optimizing building performance, enhancing sustainability, and improving the overall …",https://www.adzuna.co.uk/jobs/details/5101404881?utm_medium=api&utm_source=9b195f40,50898.48,50898.48,2025-03-19T17:33:23Z
BI Data Analyst,BGIS,"Derby, Derbyshire","Description Position: Business Intelligence & Data Analyst Company: BGIS / BSM Location : South Normanton - Hybrid Type : Full-Time About Us: BGIS is a global facility management company that operates locally in various regions, including the UK bring the best of Global business to local delivery. They provide a range of services such as hard service maintenance, energy management, and workplace solutions. BGIS focuses on optimizing building performance, enhancing sustainability, and improving …",https://www.adzuna.co.uk/jobs/details/5119753513?utm_medium=api&utm_source=9b195f40,50373.76,50373.76,2025-03-31T12:23:40Z
Asset Data Manager,BGIS,"Derby, Derbyshire","Description Position: Business Intelligence & Data Analyst Company: BGIS / BSM Location : South Normanton - Hybrid Type : Full-Time About Us: BGIS is a global facility management company that operates locally in various regions, including the UK bring the best of Global business to local delivery. They provide a range of services such as hard service maintenance, energy management, and workplace solutions. BGIS focuses on optimizing building performance, enhancing sustainability, and improving …",https://www.adzuna.co.uk/jobs/details/5119755477?utm_medium=api&utm_source=9b195f40,54289.61,54289.61,2025-03-31T12:24:54Z
Data Platform Engineer,Zimmer Biomet,"Derby, Derbyshire","At Zimmer Biomet, we believe in pushing the boundaries of innovation and driving our mission forward. As a global medical technology leader for nearly 100 years, a patient's mobility is enhanced by a Zimmer Biomet product or technology every 8 seconds. As a Zimmer Biomet team member, you will share in our commitment to providing mobility and renewed life to people around the world. To support our talent team, we focus on development opportunities, robust employee resource groups (ERGs), a flexi…",https://www.adzuna.co.uk/jobs/details/5116418578?utm_medium=api&utm_source=9b195f40,49145.37,49145.37,2025-03-28T18:58:00Z
Web Developer Trainee,ITOL Recruitment,"Derby, Derbyshire","Are you looking to benefit from a new career in Web Development? Skills shortages in the IT sector is driving the need for qualified, entry-level career seekers and career changers. We help place graduates from this programme in top UK companies and organisations needing to employ entry-level software development staff that can hit the ground running with up-to-date skills gained from this programme. The best part is you will not need any previous experience as fully accredited training, which …",https://www.adzuna.co.uk/jobs/details/5092181690?utm_medium=api&utm_source=9b195f40,25000,35000,2025-03-13T21:55:54Z
Trainee Software Developer,ITOL Recruitment,"Derby, Derbyshire","Are you looking to benefit from a new career in Software Development? Skills shortages in the IT sector is driving the need for qualified, entry-level career seekers and career changers. We help place graduates from this programme in top UK companies and organisations needing to employ entry-level software development staff that can hit the ground running with up-to-date skills gained from this programme. The best part is you will not need any previous experience as fully accredited training, w…",https://www.adzuna.co.uk/jobs/details/5090060815?utm_medium=api&utm_source=9b195f40,26000,35000,2025-03-12T21:35:45Z
Coding and Programming Trainee,ITOL Recruitment,"Derby, Derbyshire","Are you looking to benefit from a new career in Programming? Skills shortages in the IT sector are driving the need for qualified, entry-level career seekers and career changers. We help place graduates from this programme in top UK companies and organisations needing to employ entry-level Programming staff that can hit the ground running with up-to-date skills gained from this programme. The best part is you will not need any previous experience as fully accredited training, which includes tut…",https://www.adzuna.co.uk/jobs/details/5111248215?utm_medium=api&utm_source=9b195f40,26000,35000,2025-03-25T20:15:32Z
