title,company,location,latitude,longitude,description,salary_min,salary_max,redirect_url,created,search_query,search_location,source,date_downloaded,job_level,company_id,location_id,job_level_id
Senior Data Analyst,Red Engine,EC1V7LQ,,,"About Us Hello, we are Red Engine, the team behind the award-winning global brands Flight Club and Electric Shuffle. We're obsessed with disrupting the hospitality industry by creating and delivering the best possible experience - across all venues, products and brands. ? Our central team covers the full spectrum of skills needed to bring each concept to life - from design to marketing, sales to interior design, people and training, to finance, ... ",75000.0,80000.0,https://www.reed.co.uk/jobs/senior-data-analyst/55030698,2025-05-19,data analyst,England,reed,2025-05-20 17:49:22,Senior,,1306,2
Data Engineer,Brookson ,WA11RG,,,"Following the acquisition of Brookson by People2.0, the responsibilities of the Data and Analytics team have significantly expanded. We are now seeking a skilled Data Engineer to join our dynamic team. As a Data Engineer within the Data and Analytics team, you will play a pivotal role in designing, maintaining, and optimising the data architecture for People2.0 Group. This architecture ensures the seamless flow of data from source systems to the... ",34000.0,38000.0,https://www.reed.co.uk/jobs/data-engineer/55013382,2025-05-16,data analyst,England,reed,2025-05-20 17:49:22,Unknown,,1307,4
Portfolio Analyst,Vermelo RPO,M37FB,,,"Portfolio Analyst – Strategic Change Salary - 35k Location: Remote with minimal travel to one of our offices &nbsp; Are you passionate about data, trends, and driving change? Do you have a background in business analysis or data analytics and want to step into a role that shapes strategic decisions across a growing organisation? We’re looking for a Portfolio Analyst to join our dynamic Strategic Change team. This is an exciting opportunity for s... ",35000.0,35000.0,https://www.reed.co.uk/jobs/portfolio-analyst/55017615,2025-05-16,data analyst,England,reed,2025-05-20 17:49:22,Mid-level,29.0,32,1
Finance Analyst,Bakkavor,Spalding,52.7865721,-0.148526,"Finance Analyst – Commercial Conversion Proud to deliver high quality products and develop a high- quality career. Competitive Salary 10% Bonus Private Health Care Spalding – Hybrid role and working 3 days Spalding office and remote work from home Permanent 8.30 - 5pm Monday to Friday Why join us? We’re proud to offer you a career with possibilities. Where you’ll be supported to work hard, aim high and bring your best to work, every day. As a va... ",,,https://www.reed.co.uk/jobs/finance-analyst/55008960,2025-05-15,data analyst,England,reed,2025-05-20 17:49:22,Mid-level,,1265,1
Asbestos Analyst,Environmental Essentials Limited,ST56SS,,,"Job Title: Asbestos Analyst Location: Central Region Salary: 28K - 37K DOE Overtime rates Hours: Full time 42.5 hours per week 1 in 5 weekends (Paid at Overtime rates) Environmental Essentials are a well-established asbestos company with 3 offices across the UK and an excellent reputation for delivering a first class, quality focused service to a number of very high-profile clients. Due to expansion, continued growth and recent major contract wi... ",27000.0,37000.0,https://www.reed.co.uk/jobs/asbestos-analyst/55031057,2025-05-19,data analyst,England,reed,2025-05-20 17:49:22,Mid-level,,1308,1
Asbestos Analyst,Environmental Essentials Limited,Oxford,51.7520131,-1.2578499,"Job Title: Asbestos Analyst Location: Central Region Salary: 28K - 37K DOE Overtime rates Hours: Full time 42.5 hours per week 1 in 5 weekends (Paid at Overtime rates) Environmental Essentials are a well-established asbestos company with 3 offices across the UK and an excellent reputation for delivering a first class, quality focused service to a number of very high-profile clients. Due to expansion, continued growth and recent major contract wi... ",27000.0,37000.0,https://www.reed.co.uk/jobs/asbestos-analyst/55031071,2025-05-19,data analyst,England,reed,2025-05-20 17:49:22,Mid-level,,292,1
Functional Analyst,Greencore,S802RS,,,"Why Greencore? We're a leading manufacturer of convenience food in the UK and our purpose is to make everyday taste better. We're a vibrant, fast-paced leading food manufacturer. Employing around 13,600 colleagues across 16 manufacturing units and 17 distribution depots across the UK. We supply all the UK's food retailers with everything from Sandwiches, soups and sushi to cooking sauces, pickles and ready meals, and in FY23, we generated revenu... ",,,https://www.reed.co.uk/jobs/functional-analyst/55029699,2025-05-19,data analyst,England,reed,2025-05-20 17:49:22,Mid-level,19.0,1309,1
Business Operations Analyst,AWE PLC,RG74PR,,,"Business Operations Analyst Closing Date: 10th June 2025 Location: RG7 4PR , located between Reading and Basingstoke, with free onsite parking . Hybrid working is available for this role on an informal, non-contractual basis. Typically, 3 days onsite per week as a minimum. Package: 29,490- 35,000 (depending on your suitability, qualifications, and level of experience) Working pattern: AWE operates a 9-day working fortnight. We will consider flex... ",29490.0,35000.0,https://www.reed.co.uk/jobs/business-operations-analyst/55036461,2025-05-20,data analyst,England,reed,2025-05-20 17:49:22,Mid-level,337.0,1310,1
Data Engineer,Red Engine,EC1V7LQ,,,"The Job As a Data Engineer, you will be working in the Red Engine technology team, helping to build out the existing data and analytics platform. This role is placed within a small team, allowingthe successful candidate design freedom in implementing bespoke features and enhancements to our data platform using the latest technology. In this role you will assist the senior engineers in meeting with keybusiness stakeholders to gather technical req... ",50000.0,55000.0,https://www.reed.co.uk/jobs/data-engineer/55010277,2025-05-15,data analyst,England,reed,2025-05-20 17:49:22,Senior,,1306,2
Data Scientist,Bupa UK,Salford Quays,53.4726736,-2.2926886,"Job Description: Data Scientist Location:&nbsp;London EC2R 7HJ, Salford M50 3SP, Staines TW18 3DZ Hybrid working options&nbsp;– ideally 1–2 days per week in office Permanent Salary range:&nbsp; 46,400 - 60,000 (depending on experience &amp; location) Full time:&nbsp;Scheduled 37.5 hours per week We make health happen At Bupa, we’re passionate about using technology to make a meaningful difference. With our colleagues, customers, patients, and re... ",46400.0,60000.0,https://www.reed.co.uk/jobs/data-scientist/55017787,2025-05-16,data analyst,England,reed,2025-05-20 17:49:22,Unknown,27.0,30,4
Junior Data Engineer,Sagacity ,EC1N2TD,,,"Are you passionate about data and eager to kickstart your career in data engineering? We’re looking for a motivated Junior Data Engineer to join our Service Operations team. This role offers an exciting opportunity to learn, contribute to, and grow within the critical areas of data pipeline development, maintenance, and optimisation for our client-facing products and services. Working closely with experienced developers, data analysts, data scie... ",,,https://www.reed.co.uk/jobs/junior-data-engineer/55015925,2025-05-16,data analyst,England,reed,2025-05-20 17:49:22,Junior,3.0,3,5
Senior Data Engineer,Greencore,S802RS,,,"Why Greencore? We're a leading manufacturer of convenience food in the UK and our purpose is to make everyday taste better! We're a vibrant, fast-paced leading food manufacturer. Employing 13,300 colleagues across 16 manufacturing units and 17 distribution depots across the UK. We supply all the UK's food retailers with everything from Sandwiches, soups and sushi to cooking sauces, pickles and ready meals, and in FY24, we generated revenues of 1... ",,,https://www.reed.co.uk/jobs/senior-data-engineer/55013173,2025-05-16,data analyst,England,reed,2025-05-20 17:49:22,Senior,19.0,1309,2
Business Analyst Apprentice,QA,M502PW,,,"Employer description:&nbsp; Mawdsleys Ltd are a pharmaceutical wholesaler offering a wide range of services to the healthcare sector and pharmaceutical industry. Their commitment to excellence and high service levels has gained the company its reputation as a leading partner to the healthcare sector, both primary and secondary care, pharmaceutical industry, and academic institutes.&nbsp; They are an enthusiastic about talent and look to grow ind... ",25000.0,25000.0,https://www.reed.co.uk/jobs/business-analyst-apprentice/55035986,2025-05-20,data analyst,England,reed,2025-05-20 17:49:22,Apprentice,5.0,1311,3
IT Support Analyst - French Speaking,Safestore,WD62BT,,,"This is a French speaking role In our commitment to excellence, we thrive on a set of guiding principles that shape our approach at Safestore. We actively cultivate a culture where assisting colleagues isn't merely a task but a shared passion, fostering a collaborative environment that places a premium on support. Our unwavering commitment to efficiency is evident in our focus on delivering solutions that are not only clear and concise but also ... ",30000.0,34000.0,https://www.reed.co.uk/jobs/it-support-analyst-french-speaking/55037290,2025-05-20,data analyst,England,reed,2025-05-20 17:49:22,Mid-level,,1312,1
Salesforce Business Analyst,Claranet Limited,WC1V6AE,,,"Position Overview: As a Business Analyst within the Salesforce team in Claranet’s Group Information Systems department, you will play a crucial role as the interface between the business and the whole Salesforce team. Leveraging your knowledge in Sales Cloud, CPQ (Configure, Price, Quote) module and the new Revenue Cloud to support the optimisation of our Salesforce platform, you will work closely with various departments to gather requirements,... ",,,https://www.reed.co.uk/jobs/salesforce-business-analyst/55039036,2025-05-20,data analyst,England,reed,2025-05-20 17:49:22,Mid-level,443.0,1313,1
RFP Business Analyst,AMS Contingent,London,51.4893335,-0.1440551,"AMS is the world's leading provider of Talent Acquisition and Management Services. Our Contingent Workforce Solutions (CWS) service, partner with Deutsche Bank to support contingent recruitment processes. Job description - the role On behalf of Deutsche Bank, we are looking for an RFP Business Analyst for a 6 Month contract based in London (Hybrid 2-3 times in the office). Deutsche Bank is a global banking business with strong roots in Germany a... ",,,https://www.reed.co.uk/jobs/rfp-business-analyst/55013893,2025-05-16,data analyst,England,reed,2025-05-20 17:49:22,Mid-level,,26,1
Data Analyst,Adecco ,London,51.4893335,-0.1440551,"Job Title: Data Analyst Location: London/ Hybrid - 2 days in-office: Tuesday &amp; Friday Duration: Initial 6 months Day Rate: 350 - 400 per day (depending on level of experience) About the Role: We're looking for a skilled and analytical Data Analyst to support a variety of workforce-related projects while our high-profile banking clients overseas operations get up and running! Based in London with flexible remote options, you'll be working clo... ",350.0,400.0,https://www.reed.co.uk/jobs/data-analyst/55035786,2025-05-20,data analyst,England,reed,2025-05-20 17:49:22,Mid-level,71.0,26,1
Data Analyst,P3M Recruitment,Leeds,53.7974185,-1.5437941,"Job Title: Data Analyst Location: Remote (Client based in Leeds, some site attendance required) Contract: Inside IR35 Hours/Duration: Full-time, 5 days per week. Overall project expected to be 3 months in duration. The Role of Data Analyst We are actively recruiting a Data Analyst, for one of our valued clients, who are an organisation that assists their customers with achieving zero carbon emission targets. They need a Data Analyst to support t... ",,,https://www.reed.co.uk/jobs/data-analyst/55014822,2025-05-16,data analyst,England,reed,2025-05-20 17:49:22,Mid-level,,22,1
Data Analyst,Young's Employment Services Ltd,W128ND,,,"Data Analyst – London 2 Days WFH Circ 45,000 - 60,000 Excellent Bens including Bonus &nbsp; A new Data Analyst position is available to join a fast growing global ecommerce business. Our client is rapidly expanding and scaling up their ability to enable data based decision makers across the business. The Data Analyst will work primarily with finance, product and planning teams utilising the likes of Power BI, SQL, Python, PySpark and SAP amongst... ",50000.0,60000.0,https://www.reed.co.uk/jobs/data-analyst/55015599,2025-05-16,data analyst,England,reed,2025-05-20 17:49:22,Mid-level,319.0,1288,1
Data Analyst,GreatFind Recruitment,London,51.4893335,-0.1440551,"A global entertainment company , recognised for its diverse portfolio of live events and experiences across Europe and beyond, is seeking a talented Data Analyst to join its Iberia division. This role offers a fantastic opportunity to support a dynamic, fast-growing business, with clear prospects for personal development and career progression. Location: London or Madrid (with international travel) Salary: Competitive - Full-time - Permanent Abo... ",40000.0,45000.0,https://www.reed.co.uk/jobs/data-analyst/55001351,2025-05-14,data analyst,England,reed,2025-05-20 17:49:22,Mid-level,,26,1
Data Analyst,Si Recruitment,HG44EN,,,"The Data Analyst is responsible for ensuring the accuracy, security and compliance of all business-critical data across multiple brands within the Group. This role plays a key part in maintaining data quality standards, implementing best practices for data governance and supporting teams in utilizing accurate and reliable data for decision-making. Thspecialist will work closely with IT, finance, operations and compliance teams to uphold data int... ",25000.0,35000.0,https://www.reed.co.uk/jobs/data-analyst/55016648,2025-05-16,data analyst,England,reed,2025-05-20 17:49:22,Mid-level,,1314,1
Data Analyst,Hays Specialist Recruitment Limited,Wirral,53.3409714,-3.0500916,"Your new role You will be responsible for retrieving data from the system and creating reports as needed. This includes interpreting data to highlight patterns or potential issues and communicating any concerns to key stakeholders. You will maintain the accuracy and reliability of customer records through regular data checks. You will provide day-to-day IT support to staff, including resolving access issues and resetting passwords. You will be s... ",20.77,21.77,https://www.reed.co.uk/jobs/data-analyst/55040055,2025-05-20,data analyst,England,reed,2025-05-20 17:49:22,Mid-level,90.0,386,1
Data Analyst Trainee,ITOL Recruitment,BS15TR,,,"Are you looking to benefit from a new career in Data Analysis? If you are detail orientated, perceptive, organised, competent, analytical and can communicate well with those around you; you could have a truly rewarding future as a Data Analyst We do this using our specialised Data Analyst career programme which looks to assist and place qualified candidates into a career pathway in Data Analysis. Please note this career program is designed for e... ",30000.0,50000.0,https://www.reed.co.uk/jobs/data-analyst-trainee/55040423,2025-05-20,data analyst,England,reed,2025-05-20 17:49:22,Apprentice,91.0,117,3
Data Analyst Trainee,ITOL Recruitment,CV15RR,,,"Are you looking to benefit from a new career in Data Analysis? If you are detail orientated, perceptive, organised, competent, analytical and can communicate well with those around you; you could have a truly rewarding future as a Data Analyst We do this using our specialised Data Analyst career programme which looks to assist and place qualified candidates into a career pathway in Data Analysis. Please note this career program is designed for e... ",30000.0,50000.0,https://www.reed.co.uk/jobs/data-analyst-trainee/55040298,2025-05-20,data analyst,England,reed,2025-05-20 17:49:22,Apprentice,91.0,197,3
Data Analyst Trainee,Newto Training,United Kingdom,54.7023545,-3.2765753,"Are you ready to start a new career in Data Analysis? The demand for Data Analysts has grown by 20% annually, with experienced professionals earning salaries upwards of 58,000. In today’s digital world, data is critical to business decision-making, making the role of a Data Analyst indispensable. As skills shortages continue to grow, the demand for qualified entry-level professionals is on the rise. With our Data Analytics career programme we wi... ",,,https://www.reed.co.uk/jobs/data-analyst-trainee/55029521,2025-05-19,data analyst,England,reed,2025-05-20 17:49:22,Apprentice,92.0,125,3
Asset Data Analyst,Great Places Housing Association,M217QP,,,"Asset Data Analyst Salary Up to 39,248 Location Didsbury, Manchester Permanent, Full Time Reporting to the Data and Planning Manager, you will play a key role in supporting the delivery of Great Places’ Corporate Plan, Asset Management, and Sustainability Strategies. This role’s primary responsibility is to provide research, analytical insights, and quality assurance across the organisation. You will ensure data accuracy and integrity, meeting b... ",39248.0,39248.0,https://www.reed.co.uk/jobs/asset-data-analyst/55036759,2025-05-20,data analyst,England,reed,2025-05-20 17:49:22,Senior,,1315,2
Data Analyst Trainee,ITOL Recruitment,CB21BY,,,"Are you looking to benefit from a new career in Data Analysis? If you are detail orientated, perceptive, organised, competent, analytical and can communicate well with those around you; you could have a truly rewarding future as a Data Analyst We do this using our specialised Data Analyst career programme which looks to assist and place qualified candidates into a career pathway in Data Analysis. Please note this career program is designed for e... ",30000.0,50000.0,https://www.reed.co.uk/jobs/data-analyst-trainee/55039531,2025-05-20,data analyst,England,reed,2025-05-20 17:49:22,Apprentice,91.0,161,3
Data Analyst Trainee,ITOL Recruitment,SO147LY,,,"Are you looking to benefit from a new career in Data Analysis? If you are detail orientated, perceptive, organised, competent, analytical and can communicate well with those around you; you could have a truly rewarding future as a Data Analyst We do this using our specialised Data Analyst career programme which looks to assist and place qualified candidates into a career pathway in Data Analysis. Please note this career program is designed for e... ",30000.0,50000.0,https://www.reed.co.uk/jobs/data-analyst-trainee/55031570,2025-05-19,data analyst,England,reed,2025-05-20 17:49:22,Apprentice,91.0,198,3
Pricing Data Analyst,Oscar Technology,Leicester,52.6362,-1.1331969,"Role: Pricing Data Analyst Skills: SQL, Data Analysis Salary: 50k - 60k Excellent Benefits Package Location: Leicester Working Pattern: Hybrid / Flexible Summary One of Oscar's long-term clients are looking for a Pricing Data Analyst with skills in SQL, and a strong commercial awareness to join their well-established Data and Analytics team. Their office is located in the Hinckley area, with easy access to transport links. The role has opened up... ",50000.0,60000.0,https://www.reed.co.uk/jobs/pricing-data-analyst/55014979,2025-05-16,data analyst,England,reed,2025-05-20 17:49:22,Mid-level,203.0,319,1
Junior Data Analyst,Vehicle Data Global Ltd,Chesterfield,53.2352134,-1.4264097,"Junior Data Analyst / Starting salary of 24,000 (with a review after 6 months) Chesterfield | Full-time Are you passionate about data and fascinated by cars and road vehicles? Ready to take the next step in your analytics career? We’re looking for a detail-driven Junior Data Analyst to join our growing team at Vehicle Data Global Ltd in Chesterfield! Why Join Us? At Vehicle Data Global, we power the UK’s vehicle data industry. From cutting-edge ... ",23000.0,24000.0,https://www.reed.co.uk/jobs/junior-data-analyst/55037490,2025-05-20,data analyst,England,reed,2025-05-20 17:49:22,Junior,,216,5
Commercial Data Analyst,Axon Moore Group Ltd,Warrington,53.4018582,-2.5680224,"Commercial / Ecommerce Analyst Location: Birchwood, Warrington (fully office-based) Salary: 25,000 - 35,000 performance-related bonuses Recruiting exclusively via Axon Moore About the Company Axon Moore is proud to be partnering exclusively with a well-established and rapidly growing technology group based in Birchwood, Warrington. The business operates across multiple ecommerce and B2B channels and is a recognised name in the world of PC gaming... ",26000.0,35000.0,https://www.reed.co.uk/jobs/commercial-data-analyst/55029246,2025-05-19,data analyst,England,reed,2025-05-20 17:49:22,Mid-level,217.0,370,1
Pension Data Analyst,Alexander Lloyd,London,51.4893335,-0.1440551,"Our client are seeking a Pensions Data Analyst to work on complex pension data extraction, analysis, cleansing, and processing. As a Pension Data analyst you will be responsible for delivering scheme events and projects in line with client and contractual requirements, ensuring high-quality service and compliance with industry regulations. Key Responsibilities Collaborate with Scheme Events Leads and Managers to deliver scheme events and project... ",40000.0,50000.0,https://www.reed.co.uk/jobs/pension-data-analyst/55015451,2025-05-16,data analyst,England,reed,2025-05-20 17:49:22,Mid-level,211.0,26,1
PowerBI Data Analyst,Aatom Recruitment,N179LJ,,,"Working on behalf of a Local Authority, Aatom Recruitment has a new opportunity for a PowerBI Data Analyst on a 3 months contract initially with a possibility of further extension. Our mission is to preserve resources and the environment for future generations by exemplary planning, innovation and communication in managing north London’s waste. We serve two million residents in seven boroughs and run communications and engagement campaigns to he... ",48.97,64.35,https://www.reed.co.uk/jobs/powerbi-data-analyst/55009668,2025-05-15,data analyst,England,reed,2025-05-20 17:49:22,Mid-level,,1268,1
Principal & Senior Consultants - Technical Business Analyst,Intuita,Newbury,51.4020243,-1.3242212,"All our office locations considered: Newbury, London (satellite) &amp; Liverpool; OR Croatia (Šibenik) ?? The Team We're Intuita - a fast growing consultancy that's making waves in both the consultancy and technology space! With our ambitious goals for 2025 and beyond, we are looking for talented individuals to complement the team of experts we already have working across our business, becoming a pivotal part of our journey, to not just meet, bu... ",60000.0,90000.0,https://www.reed.co.uk/jobs/principal-senior-consultants-technical-business-analyst/55012801,2025-05-16,data analyst,England,reed,2025-05-20 17:49:22,Senior,439.0,973,2
Data Analyst- Higher Education,Adecco ,London,51.4893335,-0.1440551,"Are you passionate about harnessing the power of data to drive meaningful insights in the higher education sector? Our client is seeking a talented Data Analyst to join their dynamic team for a temporary assignment in South Kensington. If you thrive in an analytical environment and have a knack for transforming data into actionable reports, we want to hear from you! Position Details: Hourly Rate: 25.01ph Start Date: ASAP Contract Length: 6 weeks... ",25.01,25.01,https://www.reed.co.uk/jobs/data-analyst-higher-education/55030002,2025-05-19,data analyst,England,reed,2025-05-20 17:49:22,Mid-level,71.0,26,1
Data Analyst - Professional Services,Eutopia Solutions ltd,M21HW,,,"Data Analyst – Global Professional Services Organisation – Manchester/Hybrid - 30,000 - 35,000 &nbsp; We are proud to be partnered with our client, a prestigious Global Professional Services Firm as they look to expand their real estate/workplace experience team with an analytical focused Data professional. Spanning Europe, Asia, America and the Middle East they have a workforce of more than 5,500. This role is based in their Manchester office, ... ",30000.0,35000.0,https://www.reed.co.uk/jobs/data-analyst-professional-services/55027914,2025-05-19,data analyst,England,reed,2025-05-20 17:49:22,Mid-level,954.0,48,1
Data Business Analyst,Harvey Nash,Leeds,53.7974185,-1.5437941,Harvey Nash are delighted to be working with one of our partner organisations to recruit a Data Business Analyst. The role will be working as a Business Analyst but sit within and work closely with their data teams. As a Data Business Analyst you will bring: - Strong BA experience with Data background - Confident using different analysis and modelling techniques to clearly identify and articulate both business and data requirements - Comfortable... ,57000.0,72000.0,https://www.reed.co.uk/jobs/data-business-analyst/55039143,2025-05-20,data analyst,England,reed,2025-05-20 17:49:22,Mid-level,125.0,22,1
Trainee Data Analyst Associate,Newto Training,United Kingdom,54.7023545,-3.2765753,"Are you ready to start a new career in Data Analysis? The demand for Data Analysts has grown by 20% annually, with experienced professionals earning salaries upwards of 58,000. In today’s digital world, data is critical to business decision-making, making the role of a Data Analyst indispensable. As skills shortages continue to grow, the demand for qualified entry-level professionals is on the rise. With our Data Analytics career programme we wi... ",,,https://www.reed.co.uk/jobs/trainee-data-analyst-associate/55029343,2025-05-19,data analyst,England,reed,2025-05-20 17:49:22,Apprentice,92.0,125,3
Senior Data Quality Analyst,Avencia Consulting,London,51.4893335,-0.1440551,"We're Hiring! ?? Job Opportunity: Data Quality Analyst Location: London | Function: Data Governance | Type: Full-time The opportunity: We're looking to develop our Data Team by recruiting for a Data Quality Analyst based in London on a hybrid working pattern. The role will be responsible for developing, implementing, and maintaining processes and standards to enhance data quality across the organisation. This involves monitoring data quality per... ",80000.0,85000.0,https://www.reed.co.uk/jobs/senior-data-quality-analyst/55030892,2025-05-19,data analyst,England,reed,2025-05-20 17:49:22,Senior,458.0,26,2
