title,company,location,latitude,longitude,description,salary_min,salary_max,redirect_url,created,search_query,search_location,source,date_downloaded,job_level,company_id,location_id,job_level_id
Market Research Data Scientist,Harnham - Data & Analytics Recruitment,London,51.4893335,-0.1440551,"MARKET RESEARCH DATA SCIENTIST 50,000 - 60,000 LONDON - 4 DAYS A WEEK *Please note, you must be a UK resident to apply with full right to work in the UK* THE COMPANY This company is a fast-growing research and polling firm that started as a two-person venture and has expanded to a team of 40 across the UK and US. Known for delivering the most accurate global political polling, they specialize in qualitative and quantitative research, offering de... ",50000.0,60000.0,https://www.reed.co.uk/jobs/market-research-data-scientist/55031680,2025-05-19,data science,England,reed,2025-05-20 17:49:30,Unknown,66.0,26,4
Senior Data Scientist,Harnham - Data & Analytics Recruitment,London,51.4893335,-0.1440551,"SENIOR DATA SCIENTIST UP TO 80,000 LONDON This role is an exciting opportunity to work for a very fast-paced and data-driven FinTech, focusing on their growing credit card portfolio. THE COMPANY This company is working on loans, credit cards, and car finance and aims to get money in customers' hands in only a few minutes, not days. They are one of the fastest growing fintech companies in the UK, and are profitable, meaning they are undergoing ra... ",60000.0,80000.0,https://www.reed.co.uk/jobs/senior-data-scientist/55027305,2025-05-19,data science,England,reed,2025-05-20 17:49:30,Senior,66.0,26,2
Data Scientist - Environmental Insights,ADLIB,SW81RT,,,"Turn biodiversity data into insight at a pioneering nature tech start-up Use Python &amp; GCP to analyse real-world environmental sensor data. Create impactful dashboards for sustainability and agriculture clients. Join a fast-growing, purpose-driven team with real-world impact. We’re working with a pioneering nature tech start-up that’s using acoustic sensor technology and cloud data to support sustainability in agriculture, food production, an... ",50000.0,75000.0,https://www.reed.co.uk/jobs/data-scientist-environmental-insights/55012513,2025-05-16,data science,England,reed,2025-05-20 17:49:30,Unknown,113.0,1343,4
Data Scientist - Environmental Insights,ADLIB,YO317EX,,,"Turn biodiversity data into insight at a pioneering nature tech start-up Use Python &amp; GCP to analyse real-world environmental sensor data. Create impactful dashboards for sustainability and agriculture clients. Join a fast-growing, purpose-driven team with real-world impact. We’re working with a pioneering nature tech start-up that’s using acoustic sensor technology and cloud data to support sustainability in agriculture, food production, an... ",50000.0,75000.0,https://www.reed.co.uk/jobs/data-scientist-environmental-insights/55012494,2025-05-16,data science,England,reed,2025-05-20 17:49:30,Unknown,113.0,1344,4
AI Engineer - Machine Learning LLM,Client Server Ltd.,NE16SQ,,,"AI Engineer (Machine Learning LLM Python) Newcastle to 200k Are you an AI Engineer with a first class education looking for an opportunity to progress your career, working on complex and interesting AI systems in an impactful role? You could be joining a FinTech start-up, the company has secure backing and an established Hedge Fund client as a partner. As an AI Engineer you will join a new team responsible for evaluating and introducing AI and L... ",150000.0,200000.0,https://www.reed.co.uk/jobs/ai-engineer-machine-learning-llm/55027104,2025-05-19,data science,England,reed,2025-05-20 17:49:30,Unknown,390.0,564,4
Data Scientist with PyMC & Marketing Mixed Modelling experience,Lorien,London,51.4893335,-0.1440551,Data Scientist with PyMc &amp; Marketing Mixed Modelling experience 6 Months Contract Inside IR35 Remote/1 day onsite a month Bankside My client a top Global company are currently looking to recruit a Data Scientist with PyMc &amp; MMM experience to join their team on a 6-month contract basis. Please note if successful this position will need to set up via an Umbrella Company/PAYE. This Senior Data scientist required to work with our clients Dat... ,,,https://www.reed.co.uk/jobs/data-scientist-with-pymc-marketing-mixed-modelling-experience/55027308,2025-05-19,data science,England,reed,2025-05-20 17:49:30,Senior,88.0,26,2
Senior Sales Executive - AI Software Solutions,ALIGNMENT SEARCH AND SELECTION LIMITED,SW100AE,,,"Senior Sales Executive - AI Software Solutions Location: UK-based (Hybrid; remote considered for high-performing candidates) Salary: 70,000 - 85,000 base uncapped commission benefits Sector: Artificial Intelligence / SaaS / Enterprise Software Our client, a leading provider of AI-driven software solutions, is seeking an experienced sales professional to drive new business development across the UK and potentially Europe.This role offers the oppo... ",70000.0,85000.0,https://www.reed.co.uk/jobs/senior-sales-executive-ai-software-solutions/55039218,2025-05-20,data science,England,reed,2025-05-20 17:49:30,Senior,,466,2
Product Specialist - eLearning / AI - Leeds & Remote,Crimson,Leeds,53.7974185,-1.5437941,"Product Specialist - eLearning / AI - Leeds &amp; Remote Hybrid working - this role requires 2-3 days per week in Central Birmingham OR Leeds. Salary: 40,000 per annum We are looking for a Product Specialist to join our customers growing team in Birmingham City Centre. In this role, you'll play a key part in driving the adoption of our technology solutions and improving the customer experience. You'll use your product expertise to reduce barrier... ",40000.0,40000.0,https://www.reed.co.uk/jobs/product-specialist-elearning-ai-leeds-remote/55036687,2025-05-20,data science,England,reed,2025-05-20 17:49:30,Senior,469.0,22,2
Product Specialist - eLearning / AI - Birmingham & Remote,Crimson,Birmingham,52.4796992,-1.9026911,"Product Specialist - eLearning / AI - Birmingham &amp; Remote Hybrid working - this role requires 2-3 days per week in Central Birmingham OR Leeds. Salary: 40,000 per annum We are looking for a Product Specialist to join our customers growing team in Birmingham City Centre. In this role, you'll play a key part in driving the adoption of our technology solutions and improving the customer experience. You'll use your product expertise to reduce ba... ",40000.0,40000.0,https://www.reed.co.uk/jobs/product-specialist-elearning-ai-birmingham-remote/55031820,2025-05-19,data science,England,reed,2025-05-20 17:49:30,Senior,469.0,100,2
Science Teacher,Reeson Education,N169EX,,,"SCIENCE TEACHER REQUIRED Can you consider a new Science Teacher post in Hackney, North London Hackney, East London Science Teacher From September 2025 Popular school with excellent support. Full time Science Teacher role across the secondary age and ability range. Strong Senior Leadership Team / Great Science Department. Positive environment ABOUT THE SCHOOL - SCIENCE TEACHER A hugely popular East London school are looking for a Science Teacher ... ",34157.0,55935.0,https://www.reed.co.uk/jobs/science-teacher/55031882,2025-05-19,data science,England,reed,2025-05-20 17:49:30,Senior,399.0,574,2
Urgent Requirement for Lead Data Scientist based in London(Fully Remote),Vbeyond,E17DB,,,"Seeking a senior/lead data scientist to be part of a team that will be dedicated to build and support Generative AI, Machine learning, Deep Learning and Data science solutions across the organization. Specific Emerging Technology team objectives are: Gen AI/ML technology implementation with business and product owners Emerging Tech Governance function covering policies, guidelines and processes to govern AI/ML enabled components as well as third... ",,,https://www.reed.co.uk/jobs/urgent-requirement-for-lead-data-scientist-based-in-londonfully-remote/55036976,2025-05-20,data science,England,reed,2025-05-20 17:49:30,Senior,,1345,2
Data Warehouse Manager,Sanderson,Chester,53.1908873,-2.8908955,"Are you passionate about data and analytics? Our client is seeking a Data Warehouse Manager to lead a diverse team in delivering innovative data warehousing solutions. This role involves supporting daily operations and modernizing our data warehousing function with industry-leading tools in a cloud environment. We welcome candidates from all backgrounds with experience in SAS, ETL, and Python. Key Responsibilities: Lead and coordinate the data w... ",,,https://www.reed.co.uk/jobs/data-warehouse-manager/55030964,2025-05-19,data science,England,reed,2025-05-20 17:49:30,Senior,84.0,508,2
Computer Science Teacher,Inspiring Teaching ,South East London,51.4856331,-0.0467842,"We are seeking a dedicated and enthusiastic Secondary School Computer Science Teacher to join our team in delivering the UK school curriculum. In this role, you will be responsible for planning and delivering engaging lessons in programming, algorithms, data representation, cyber security, and computational thinking to students in Key Stage 3 and Key Stage 4 (GCSE). The ideal candidate should have a solid understanding of the UK curriculum requi... ",180.0,280.0,https://www.reed.co.uk/jobs/computer-science-teacher/55004164,2025-05-15,data science,England,reed,2025-05-20 17:49:30,Unknown,,426,4
Curriculum Manager for Vocational Sciences,Capital City College Group,EC1V7LA,,,"Passionate about shaping the future of Science? Join our London-based Further Education team as a Curriculum Manager and lead the development and delivery of outstanding, industry-relevant programmes that shape your student's futures. About the Role: Curriculum Manager - Vocational Science As a Curriculum Manager, you will play a pivotal role in driving forward our strategic objectives and ensuring the highest standards of teaching, learning, an... ",,,https://www.reed.co.uk/jobs/curriculum-manager-for-vocational-sciences/55005947,2025-05-15,data science,England,reed,2025-05-20 17:49:30,Senior,,1285,2
Enterprise Architect,Red Engine,EC1V7LQ,,,"The Job We’re seeking a strategic, hands-on Enterprise Architect, to shape and evolve the application and systems landscape across our brands with strong experience of leveraging hospitality systems for business growth. The Enterprise Architect is is a key role which sits at the intersection of enterprise solutions, operations, and growth, ensuring our hospitality systems are set up for scalable, data-driven success and owning the long-term ente... ",75000.0,80000.0,https://www.reed.co.uk/jobs/enterprise-architect/55010261,2025-05-15,data science,England,reed,2025-05-20 17:49:30,Senior,,1306,2
Computer Science Teacher,Tradewind Recruitment,Hounslow,51.4686132,-0.3613471,"Computing and ICT Teacher - Hounslow, Outer London Are you an enthusiastic and skilled Computing and ICT Teacher looking to inspire the next generation of digital leaders? An Outstanding boys' secondary school in Hounslow is seeking a committed and innovative Computing and ICT Teacher to join their forward-thinking team from September 2025 on a permanent basis. This is an exciting opportunity to teach in a high-achieving environment that values ... ",36412.0,53994.0,https://www.reed.co.uk/jobs/computer-science-teacher/55011997,2025-05-16,data science,England,reed,2025-05-20 17:49:30,Unknown,412.0,95,4
Process Manager,Muller UK & Ireland,Stonehouse,51.7474678,-2.283024,"We are currently recruiting for a Process Manager to join us at our Severnside Dairy Job Purpose: Site responsibility for all movement and processing of liquids, Clean in Process (CIP's) controlled by Scada software and advisor for site in relation to health, safety and environmental. Salary: Competitive Hours: 40 hours per week (Mon-Fri) Location: Severnside Tasks and Responsibilities Responsible for all movement of fluids from cream intake to ... ",,,https://www.reed.co.uk/jobs/process-manager/55005357,2025-05-15,data science,England,reed,2025-05-20 17:49:30,Senior,,1286,2
Interim Finance Director AI SaaS Scale-Up 6-Month Contract,Harmonic Group Ltd,London,51.4893335,-0.1440551,Interim Finance Director | AI SaaS Scale-Up | 6-Month Contract Harmonic are delighted to be working with an AI/SaaS Scale-Up to recruit an experienced Interim Finance Director on an initial 6-Month contract. Our client has received significant funding (circa 50m) over the last 2 years which has led to a rapidly growing head count within the finance department. The Client Our client has developed a powerful SaaS product which is utilised by large... ,700.0,900.0,https://www.reed.co.uk/jobs/interim-finance-director-ai-saas-scale-up-6-month-contract/55040533,2025-05-20,data science,England,reed,2025-05-20 17:49:30,Senior,,26,2
Head of IT - Data & Applications,MLC Partners ,NW33HY,,,"MLC Partners are proud to be working in exclusive partnership with a prestigious higher education institution in North London to appoint a Head of IT - Applications and Data. This is a pivotal leadership role at the heart of a forward-thinking IT function, driving digital transformation, systems integration, and data innovation. About the Role This newly designed position is both hands-on and strategic, ideal for someone looking to take ownershi... ",53000.0,59000.0,https://www.reed.co.uk/jobs/head-of-it-data-applications/55016848,2025-05-16,data science,England,reed,2025-05-20 17:49:30,Senior,,1346,2
Process Manager,Muller UK & Ireland,GL102DG,,,"Müller UK &amp; Ireland is wholly owned by Unternehmensgruppe Theo Müller which employs over 31,000 people throughout Europe. In the UK, Müller develops, manufactures and markets a wide range of branded and private label dairy products made with milk from 1,300 farmers in Britain.Müller is ranked within the top 20 in The Grocer’s Top 100 list of Britain’s Biggest Brands and is picked from shelves millions of times each year. Müller UK &amp; Irel... ",,,https://www.reed.co.uk/jobs/process-manager/55039681,2025-05-20,data science,England,reed,2025-05-20 17:49:30,Senior,,1347,2
Visiting Scheme Manager - Guildford,Clarion,Guildford,51.2356068,-0.5732063,"Salary: 16,758.19 per annum Job Location: Guildford - Reeve Court Hours: 25 hours per week Contract Type: Permanent Operating Company: Grange Property Management Are you customer focused, confident and logical with excellent communication skills? Grange Property Management are looking for a Visiting Scheme Manager to look after our scheme at Reeve Court in Guildford. With a 'can do' attitude you'll prioritise and manage your own workload indepen... ",16758.19,16758.19,https://www.reed.co.uk/jobs/visiting-scheme-manager-guildford/55016126,2025-05-16,data science,England,reed,2025-05-20 17:49:30,Senior,53.0,261,2
Privacy & Data Associate,Douglas Scott Legal Recruitment ,EC4M9DQ,,,"A top 50 international law firm with a strong presence in London is seeking talented and ambitious Associates with 1 and 4 years PQE to join the growing Cyber and Data Privacy team. In this role, you will provide expert legal advice on data protection, privacy laws, cybersecurity matters, and emerging digital regulations to a diverse clientele, including multinational corporations, technology firms, and financial institutions. Known for its comm... ",97000.0,115000.0,https://www.reed.co.uk/jobs/privacy-data-associate/55012970,2025-05-16,data science,England,reed,2025-05-20 17:49:30,Senior,,1348,2
Lead Data Engineer,First Achieve Ltd,London,51.4893335,-0.1440551,"Lead Data Engineer - up to 100k - West London, Hybrid Do you want to join a data team that is investing in technology and looking to innovate? Are you the sort of person who can help take data functions to the next level? Are you looking to step up into a Lead position? If the answer is yes then this tech business will be for you. The product in for this business is data, meaning your department is the most important in the company. At the heart... ",75000.0,100000.0,https://www.reed.co.uk/jobs/lead-data-engineer/55039369,2025-05-20,data science,England,reed,2025-05-20 17:49:30,Senior,,26,2
Electrician - East Grinstead,Clarion,East Grinstead,51.1322179,-0.0117661,"Salary: 36,000 - 41,000 plus, Van, Tools, Company Bonus Scheme and regular overtime Location: East Grinstead and Crawley Hours: 40 hours per week Contract Type: Permanent We have an exciting opportunity for a qualified Electrician with skills in other trades to join our team!!! We're looking for someone who can deliver a first class service to our properties covering East Grinstead, Crawley and surrounding areas. A Multi Trade Operative will be ... ",36000.0,41000.0,https://www.reed.co.uk/jobs/electrician-east-grinstead/55038440,2025-05-20,data science,England,reed,2025-05-20 17:49:30,Unknown,53.0,607,4
Over 55's Housing - Complex Manager,Clarion,SO186SG,,,"Salary: 23,587.20 - 31,024 per annum pro rata Location: Southampton - Milverton Court Hours: 27 per week - Monday - Friday Contract Type: 12 month Fixed Term Contract We're looking for someone with good customer care skills to provide a focused management service to our residents living in our Over 55's Housing schemes. You'll be required to manage access to the building for residents, contractors and visitors, and be a key-holder for the buildi... ",23587.0,31024.0,https://www.reed.co.uk/jobs/over-55s-housing-complex-manager/55031114,2025-05-19,data science,England,reed,2025-05-20 17:49:30,Senior,53.0,1349,2
Data Warehouse Engineer,Future Prospects,Newark,53.0736266,-0.8005422,"Data Warehouse Engineer Newark, Full Time, Permanent, Hybrid working available Salary up to 38,000 per annum Our award-winning client, based in Newark, Nottinghamshire is seeking a highly skilled Data Warehouse Engineer to join their Data and Analytics team. This is a full time, permanent position with the opportunity for hybrid working. THE ROLE As a Data Warehouse Engineer , you will have the following responsibilities: Design, develop, and ma... ",35000.0,38000.0,https://www.reed.co.uk/jobs/data-warehouse-engineer/55036011,2025-05-20,data science,England,reed,2025-05-20 17:49:30,Unknown,,1350,4
Service Improvement Lead,Clarion,London,51.4893335,-0.1440551,"Location: Hybrid - London or Norwich London: 48,988 to 67,358 per annum, pro rata Norwich: 45,169 to 62,107 per annum, pro rata Hours: 36 hours per week Contract Type: Permanent We're one of LinkedIn's Top Companies 2024! Change. Improvement. Transformation. Are you passionate about making things better for our customers and our people? If so, the Service optimisation team have an exciting opportunity for you! Reporting to the Service Improvemen... ",45169.0,67358.0,https://www.reed.co.uk/jobs/service-improvement-lead/55028571,2025-05-19,data science,England,reed,2025-05-20 17:49:30,Senior,53.0,26,2
Service Improvement Lead,Clarion,Norwich,52.6285576,1.2923954,"Location: Hybrid - London or Norwich London: 48,988 to 67,358 per annum, pro rata Norwich: 45,169 to 62,107 per annum, pro rata Hours: 36 hours per week Contract Type: Permanent We're one of LinkedIn's Top Companies 2024! Change. Improvement. Transformation. Are you passionate about making things better for our customers and our people? If so, the Service optimisation team have an exciting opportunity for you! Reporting to the Service Improvemen... ",45169.0,67358.0,https://www.reed.co.uk/jobs/service-improvement-lead/55028807,2025-05-19,data science,England,reed,2025-05-20 17:49:30,Senior,53.0,693,2
Cybersecurity & Data Privacy Associate,Douglas Scott Legal Recruitment ,E16AD,,,"A US law firm is seeking to hire a Cybersecurity &amp; Data Privacy Associate (1–7 PQE) to join its dynamic team in London. This is a unique opportunity to work with a leading, globally integrated practice at the cutting edge of privacy, cybersecurity, and AI law. &nbsp;&nbsp; The firm’s Cybersecurity &amp; Data Privacy team is known for its multidisciplinary approach and its ability to navigate complex, high-profile issues for top-tier clients.... ",180000.0,280000.0,https://www.reed.co.uk/jobs/cybersecurity-data-privacy-associate/55012851,2025-05-16,data science,England,reed,2025-05-20 17:49:30,Mid-level,,1351,1
Software Engineer Apprentice,QA,NE49PQ,,,"Employer description: Uptivity is an award-winning, innovative tech company based in Newcastle, with an international customer base and a growing portfolio of SaaS applications. We’re scaling fast - and looking for an &nbsp;ambitious, curious, and tech-savvy individual to join us as Software Engineer Apprentice. This is an exciting opportunity to join our expert engineering team while completing your Level 4 Software Engineering apprenticeship. ... ",20000.0,20000.0,https://www.reed.co.uk/jobs/software-engineer-apprentice/55040146,2025-05-20,data science,England,reed,2025-05-20 17:49:30,Apprentice,5.0,1352,3
Content Management System Exec,Holland & Barrett International Limited,London,51.4893335,-0.1440551,"H&amp;B&amp;Me &nbsp;is driving positive behavioural change through our tech-enabled platform. Our expert digital coach makes healthy living accessible for everyone, with science-backed wellness solutions, proven to enhance personal wellbeing and quality of life. Leveraging the Holland &amp; Barrett brand, we bridge the gap between wellness and proactive health, delivering positive behavioural change for our customers. We're on a mission to help... ",,,https://www.reed.co.uk/jobs/content-management-system-exec/55029660,2025-05-19,data science,England,reed,2025-05-20 17:49:30,Senior,26.0,26,2
Software Engineering Manager,Saab UK,Farnborough,51.2918693,-0.7539836,"Introduction Saab UK is part of Scandinavia's largest defence company, bringing together the best of Swedish and British innovation. Saab offers world-leading solutions and services in defence, aviation, space, and civil security to keep people and society safe. Our UK presence has been growing at pace, meaning we can offer a wide range of opportunities for personal fulfilment and career growth. We currently employ over 600 people across eight s... ",,,https://www.reed.co.uk/jobs/software-engineering-manager/55027484,2025-05-19,data science,England,reed,2025-05-20 17:49:30,Senior,326.0,127,2
Team Leader,Costa Coffee,Ashford,51.148555,0.8722566,"At Costa Coffee, we are what we craft. It's about blending beans with dedication, serving up memorable moments, and proudly making greatness every day. And as a Team Leader, you can too. So, why Costa? Starting pay 12.93 – 13.93 per hour , rising with training to 13.43- 14.43 (dependant store location) We're a global coffee brand with bold plans and some pretty brilliant perks to sweeten the deal: Access to the Coca-Cola share scheme including m... ",12.93,13.93,https://www.reed.co.uk/jobs/team-leader/55013611,2025-05-16,data science,England,reed,2025-05-20 17:49:30,Unknown,165.0,724,4
Order Management Specialist,INGRAM MICRO (UK) LIMITED,MK92EA,,,"About the Job An exciting opportunity has arisen for a result-driven person to join our Order Management Team on a permanent basis. Our Order Management Team is a crucial part of the success and as the business continues to grow, we need to ensure we are able to effectively manage customers’ orders from receipt to delivery. What your role as an Order Management Specialist will involve: Manage the end-to-end order management process Work collabor... ",,,https://www.reed.co.uk/jobs/order-management-specialist/55030905,2025-05-19,data science,England,reed,2025-05-20 17:49:30,Senior,,332,2
HR Business Partner,INGRAM MICRO (UK) LIMITED,CW97UA,,,"HR Business Partner Location - Hybrid, 2 days a week in Northwich &amp; 1 day Milton Keynes About the Job and Team: It truly is all about the people at Ingram Micro. We work as one team in delivering outstanding value for our vendor and customer partners. Our HR team is a crucial part of this success and as the business continues to grow, we need to ensure we can support our people effectively. To support this vision, we now have an opportunity ... ",,,https://www.reed.co.uk/jobs/hr-business-partner/55030906,2025-05-19,data science,England,reed,2025-05-20 17:49:30,Unknown,,800,4
Internal Account Manager,INGRAM MICRO (UK) LIMITED,MK92EA,,,"About the Job We are looking for driven Internal Account Manager to join our UCC team on a permanent basis supporting our key Vendors. The focus of this role is to manage a number of key accounts, maintaining and improving on revenue and profit, whilst maintaining the highest standards of customer service. Our customers and vendors are at the heart of everything we do, and this is where you come in! What your role as an Internal Account Manager ... ",,,https://www.reed.co.uk/jobs/internal-account-manager/55030912,2025-05-19,data science,England,reed,2025-05-20 17:49:30,Senior,,332,2
Data Engineer - Non-Profit / Health Charity - Cambridge,Noir,Cambridge,52.2055314,0.1186637,"Data Engineer - Non-Profit / Health Charity - Cambridge (Tech Stack: Data Engineer, Python, Azure, Power BI, AWS QuickSight, AWS, TSQL, ETL, Agile Methodologies) A leading health charity based in Cambridge is seeking a talented and driven Lead Data Engineer to join their team. This is a fantastic opportunity to take on a strategic role within an organisation making a real difference in public health. The role is offered on a hybrid basis, with a... ",50000.0,55000.0,https://www.reed.co.uk/jobs/data-engineer-non-profit-health-charity-cambridge/55015820,2025-05-16,data science,England,reed,2025-05-20 17:49:30,Senior,438.0,297,2
