title,company,location,latitude,longitude,description,salary_min,salary_max,redirect_url,created,search_query,search_location,source,date_downloaded,job_level,company_id,location_id,job_level_id
Head of AI and Capacity Creation - CFT - M&G plc.,M&G plc.,"Stirling, County Stirling",56.1194,-3.93588,"At M&G our purpose is to give everyone real confidence to put their money to work. As an international savings and investments business with roots stretching back more than 170 years, we offer a range of financial products and services through Asset Management, Life and Wealth. All three operating segments work together to deliver attractive financial outcomes for our clients, and superior shareholder returns. Through our behaviours of telling it like it is, owning it now, and moving it forward…",74781.39,74781.39,https://www.adzuna.co.uk/jobs/land/ad/5185074584?se=MIQ2dpo18BG7JofN3rWCew&utm_medium=api&utm_source=9b195f40&v=14206D8BE0CF843A7643C1AFB35DFEF6D9DE1796,,data science,Scotland,adzuna,2025-05-20 17:49:57,Senior,766.0,1115,2
Customer Experience Specialist,Getronics,"Glasgow, Scotland",55.86026,-4.25596,"Getronics is a global leader in technology solutions with a team of over 4,000 colleagues in 22 centres, providing comprehensive end-to-end services across the globe. Our mission is to deliver and continually evolve reliable IT services and solutions to empower organisations to maximise their business potential. We have an exciting opportunity for a Customer Experience Analyst to join our team! What we can give you: 37.5-hour working week with flexible working options, giving you that much need…",39347.99,39347.99,https://www.adzuna.co.uk/jobs/land/ad/5170683627?se=MIQ2dpo18BG7JofN3rWCew&utm_medium=api&utm_source=9b195f40&v=5B67C06B9DAE6B5A5620D902E8C559B7A79A67B9,,data science,Scotland,adzuna,2025-05-20 17:49:57,Senior,643.0,1059,2
Product Owner,Avidity,"Scotland, UK",56.79918,-4.254873,"Product Owner- Thumbprint Location: Remote Full Time, Permanent Salary: Upto £65K, plus lots of other great benefits Thumbprint's products help to deliver what's most important for brands to sell more – they identify the opportunities to act on today and influence the strategy that’ll unlock your growth potential in grocery multiple and symbol & independent convenience retail stores. Our two main products are Dart and Pinpoint. We are looking for a Product Owner to join our busy team. You will …",60000.0,65000.0,https://www.adzuna.co.uk/jobs/land/ad/5188770041?se=MIQ2dpo18BG7JofN3rWCew&utm_medium=api&utm_source=9b195f40&v=AE4C365396C4DD4E6935F819C7D4590BD534A35A,,data science,Scotland,adzuna,2025-05-20 17:49:57,Unknown,943.0,1071,4
Associate Quantity Surveyor,Conrad Consulting,"Edinburgh, Scotland",55.943116,-3.327942,"Associate Quantity Surveyor Edinburgh 65,000 - 70,000 We are currently looking for an Associate Quantity Surveyor from a quantity surveying consultancy background to fill a permanent opening with a company located in the City Centre of Edinburgh. Interested candidates will have the opportunity to work across a variety of projects ranging from but not exclusive to, Commercial, Residential, Education, Student Accommodation, Industrial, Life Sciences, and Data Centre sectors. Requirements of the A…",65000.0,70000.0,https://www.adzuna.co.uk/jobs/land/ad/5200606904?se=MIQ2dpo18BG7JofN3rWCew&utm_medium=api&utm_source=9b195f40&v=AB4F99C43BB5F116D263ED043DCAEF8C222C8283,,data science,Scotland,adzuna,2025-05-20 17:49:57,Mid-level,,1056,1
Mechanical Estimator,LJB & Co,"Glasgow, Scotland",55.86026,-4.25596,"Mechanical Estimator Data Centres Glasgow Our client is a €2bn turnover, Tier:1 main contractor operating across the UK, Ireland & Europe. They undertake major, complex schemes with a particular emphasis on Data Centres, Pharmaceutical and Life Science projects Due to continued growth in the region of their Data Centre projects division, our client is now seeking an experienced Mechanical Estimator . Responsibilities Prepare Detailed Estimates: Develop accurate cost estimates for mechanical sys…",60000.0,60000.0,https://www.adzuna.co.uk/jobs/land/ad/5165389499?se=MIQ2dpo18BG7JofN3rWCew&utm_medium=api&utm_source=9b195f40&v=F1E4FBD96172CA1331E5EF92198E7A26EDEE231E,,data science,Scotland,adzuna,2025-05-20 17:49:57,Mid-level,,1059,1
Data Science Placement Programme,Career Change,"Grangetown, Cardiff",51.47395,-3.175695,"Data Scientist Placement Programme - No Experience Required Our training will help you kick-start a new career as a Data Scientist. We are recruiting for companies who are looking to employ our Data Science Traineeship graduates to keep up with their growth. The best part is you will not need any previous experience as full training will be provided. You will also have the reassurance of a job guarantee within 20 miles of your location upon completion. Whether you are working full time, part-ti…",29580.92,29580.92,https://www.adzuna.co.uk/jobs/land/ad/4978246487?se=Lj1bd5o18BGOFfzmRSZXLA&utm_medium=api&utm_source=9b195f40&v=565DE4F70A82A41B963C55A1A9792188AB96FB23,,data science,Wales,adzuna,2025-05-20 17:50:01,Unknown,700.0,1080,4
Junior Data Consultant,Sparta Global Limited,"Cardiff County, Wales",51.503169,-3.1785765,"About Sparta Global Embark on a transformative career journey with Sparta Global, where diversity, innovation, and passion for technology converge. We welcome individuals from all backgrounds, offering not just jobs, but dynamic careers in the tech industry. You'll work alongside enthusiastic professionals, receiving top-tier training and mentorship to hone your skills for success in both public and private sectors. Our commitment to designing impactful careers and coaching future leaders is ev…",24000.0,24000.0,https://www.adzuna.co.uk/jobs/land/ad/5197561533?se=Lj1bd5o18BGOFfzmRSZXLA&utm_medium=api&utm_source=9b195f40&v=D4F151A316FBFDB89C9A938E3DEEA59B8FEDB674,,data science,Wales,adzuna,2025-05-20 17:50:01,Junior,985.0,1077,5
Senior Decision Scientist,Wealthify,"Penarth, The Vale of Glamorgan",51.436199,-3.1756,"Company Overview: Wealthify is an ambitious, multi-award-winning online investment company located in Penarth, Wales. We’re here to inspire anyone to build their future wealth, and we do this by making investing easy, affordable, and accessible. We’re hiring talented people who are purpose driven and want to use and develop their skills to deliver an awesome experience to our customers. Our team is engaging, inquisitive, and inclusive, reflecting many different beliefs and backgrounds. We welco…",39116.54,39116.54,https://www.adzuna.co.uk/jobs/land/ad/5193387790?se=Lj1bd5o18BGOFfzmRSZXLA&utm_medium=api&utm_source=9b195f40&v=D4D3B8C3C5C0403A7997739098D4F06280F0CACB,,data science,Wales,adzuna,2025-05-20 17:50:01,Senior,773.0,1117,2
Recruitment Consultant,Yolk Recruitment Ltd,"Cardiff County, Wales",51.503169,-3.1785765,"RECRUITMENT CONSULTANT - £30,000/£40,000 PER ANNUM  COMMS & BENEFITS - HYBRID Yolk Technology & Digital works with industry-leading employers across the UK and Ireland. We cover hundreds of opportunities across a huge breadth of technology verticals with household names, savvy start-ups, and heavyweight titans of future-thinking software. Our specialist Technology & Digital recruitment team are experts in placing top tech talent into temp, contract, and permanent positions throughout our growin…",34320.98,34320.98,https://www.adzuna.co.uk/jobs/land/ad/5189800263?se=Lj1bd5o18BGOFfzmRSZXLA&utm_medium=api&utm_source=9b195f40&v=7CF809E3549EA8E9A5320ACA45835A850F86F808,,data science,Wales,adzuna,2025-05-20 17:50:01,Senior,85.0,1077,2
Senior National Account Manager,The Cake Crew,"Llanfor, Bala",52.910118,-3.591589,"The Cake Crew are looking for an experienced Senior National Account Manager/Account Controller to join our commercial team. The ideal candidate will have experience in an FMCG environment and exposure to the major multiples. The role involves liaising with, externally – Retailers, Suppliers & Providers of Services, internally – Finance, Technical, NPD, Operations, Procurement, Supply Chain & Senior Management. PERSON PROFILE Excellent communication, organisation and decision making skills, wit…",75000.0,75000.0,https://www.adzuna.co.uk/jobs/land/ad/5170885405?se=Lj1bd5o18BGOFfzmRSZXLA&utm_medium=api&utm_source=9b195f40&v=04496677B455D39031A857791039D52B1AD87C24,,data science,Wales,adzuna,2025-05-20 17:50:01,Senior,774.0,1118,2
Graduate Environmental Technician,HAYS,"Bangor, Gwynedd",53.227798,-4.13405,"Your new company Our client is an independent multidisciplinary engineering, environmental and project management consultancy. They provide essential support across a wide range of sectors at all stages of built environment development that improves local communities, protects our environment, and creates value for their clients. They are also proud to be accredited as Gold Investors in People, reflecting their commitment to excellence and the trusted expertise of their team. Your new role This…",24982.24,24982.24,https://www.adzuna.co.uk/jobs/land/ad/5197604347?se=Lj1bd5o18BGOFfzmRSZXLA&utm_medium=api&utm_source=9b195f40&v=554CF2DAE60A31744DB125ED1836D87F7BD74153,,data science,Wales,adzuna,2025-05-20 17:50:01,Graduate,560.0,1122,6
AI Security Engineer,KLA,"Newport, Wales",51.5877,-2.99834,"Company Overview The SPTS division of KLA, designs, manufactures and markets wafer processing solutions for the global semiconductor and related industries. SPTS provides industry leading etch and deposition process technologies on a range of single wafer handling platforms. End-market applications include micro-electromechanical systems (MEMS), advanced packaging, LED, high speed RF device IC’s and power semiconductors. SPTS is part of KLA Corporation which develops industry-leading equipment …",63087.18,63087.18,https://www.adzuna.co.uk/jobs/details/5203615854?utm_medium=api&utm_source=9b195f40,,data science,Wales,adzuna,2025-05-20 17:50:01,Unknown,775.0,1074,4
Equipment Design Engineer,KLA,"Newport, Wales",51.5877,-2.99834,"Company Overview The SPTS division of KLA, designs, manufactures and markets wafer processing solutions for the global semiconductor and related industries. SPTS provides industry leading etch and deposition process technologies on a range of single wafer handling platforms. End-market applications include micro-electromechanical systems (MEMS), advanced packaging, LED, high speed RF device IC’s and power semiconductors. SPTS is part of KLA Corporation which develops industry-leading equipment …",55313.52,55313.52,https://www.adzuna.co.uk/jobs/details/5203615758?utm_medium=api&utm_source=9b195f40,,data science,Wales,adzuna,2025-05-20 17:50:01,Unknown,775.0,1074,4
Etch Process Engineer,KLA,"Newport, Wales",51.5877,-2.99834,"Company Overview The SPTS division of KLA, designs, manufactures and markets wafer processing solutions for the global semiconductor and related industries. SPTS provides industry leading etch and deposition process technologies on a range of single wafer handling platforms. End-market applications include micro-electromechanical systems (MEMS), advanced packaging, LED, high speed RF device IC’s and power semiconductors. SPTS is part of KLA Corporation which develops industry-leading equipment …",49728.38,49728.38,https://www.adzuna.co.uk/jobs/details/5201399777?utm_medium=api&utm_source=9b195f40,,data science,Wales,adzuna,2025-05-20 17:50:01,Unknown,775.0,1074,4
Cybersecurity Engineer,KLA,"Newport, Wales",51.5877,-2.99834,"Company Overview The SPTS division of KLA, designs, manufactures and markets wafer processing solutions for the global semiconductor and related industries. SPTS provides industry leading etch and deposition process technologies on a range of single wafer handling platforms. End-market applications include micro-electromechanical systems (MEMS), advanced packaging, LED, high speed RF device IC’s and power semiconductors. SPTS is part of KLA Corporation which develops industry-leading equipment …",60102.18,60102.18,https://www.adzuna.co.uk/jobs/details/5201951192?utm_medium=api&utm_source=9b195f40,,data science,Wales,adzuna,2025-05-20 17:50:01,Unknown,775.0,1074,4
Resilience / Business Continuity Specialist,KLA Corporation,"Newport, Wales",51.5877,-2.99834,"Company Overview The SPTS division of KLA, designs, manufactures and markets wafer processing solutions for the global semiconductor and related industries. SPTS provides industry leading etch and deposition process technologies on a range of single wafer handling platforms. End-market applications include micro-electromechanical systems (MEMS), advanced packaging, LED, high speed RF device IC’s and power semiconductors. SPTS is part of KLA Corporation which develops industry-leading equipment …",81135.73,81135.73,https://www.adzuna.co.uk/jobs/details/5201970604?utm_medium=api&utm_source=9b195f40,,data science,Wales,adzuna,2025-05-20 17:50:01,Senior,777.0,1074,2
M&E Project Manager,MK Search,"Bassaleg, Newport",51.578343,-3.046148,"M&E Project Manager Opportunity - Leading M&E Contractor - Flagship Logistics Hub Project - 8-12 Week Contract MK Search are working with a well established M&E contractor with a big presence in the commercial, life sciences, data centre and industrial sectors who are currently delivering a £4m logistics hub in Newport, Wales. The company in question are looking to engage with an experienced M&E Project Manager for a short term contract to assist with the delivery of the exciting project, you w…",104000.0,117000.0,https://www.adzuna.co.uk/jobs/land/ad/5183999614?se=vG6QeJo18BG7JofN3rWCew&utm_medium=api&utm_source=9b195f40&v=CE0BBA96C06CD1A56D5272D1BBAF0F8E6552882B,,data science,Wales,adzuna,2025-05-20 17:50:01,Senior,780.0,1125,2
Brand & Marketing Executive - Cardiff,Clear Choice Recruitment,"Splott, Cardiff",51.475732,-3.143901,"Our client who operates within the healthcare, hygiene and scientific sectors are looking for a proactive and creative Brand and Marketing Executive to support the development and execution of our client’s brand and marketing strategy in a B2B environment. You will help position their brand effectively in the market, deliver high-impact campaigns, and generate awareness and leads across multiple channels. Responsibilities: Maintain and evolve the brand across global markets, ensuring consistenc…",41028.09,41028.09,https://www.adzuna.co.uk/jobs/details/5203736213?utm_medium=api&utm_source=9b195f40,,data science,Wales,adzuna,2025-05-20 17:50:01,Unknown,,1120,4
Senior Data Scientist (Hybrid),Allstate Northern Ireland,"Belfast, Northern Ireland",54.5975804,-5.9277097,"At Allstate, great things happen when our people work together to protect families and their belongings from lifes uncertainties. And for more than 90 years our innovative drive has kept us a step ahead of our customers evolving needs. From advocating for seat belts, air bags and graduated driving laws, to being an industry leader in pricing sophistication, telematics, and, more recently, device and identity protection. Your role in the team Data, Discovery, and Decision Science (D3) is the res…",70000.0,70000.0,https://www.adzuna.co.uk/jobs/land/ad/5207104868?se=7Nsyepo18BGOFfzmRSZXLA&utm_medium=api&utm_source=9b195f40&v=EF4E450AD19077DBF424899ABCCCBB322E2E73A4,,data science,Northern Ireland,adzuna,2025-05-20 17:50:04,Senior,,1084,2
Head of Data Science,MCS Group | Your Specialist Recruitment Consultancy,"Londonderry, Derry",54.994499,-7.32,"MCS Group is working exclusively with one of the UK and Ireland's fastest-growing businesses in their search for a Head of Data Science. We're looking for a strategic, hands-on leader to help shape and drive the growth of their data science vision. You'll lead a high-performing team, develop cutting-edge AI solutions which are being deployed global across enterprise level organisations, and deliver insights that power real business impact. With a presence in the North West of Northern Ireland, …",65699.7,65699.7,https://www.adzuna.co.uk/jobs/land/ad/5197614732?se=7Nsyepo18BGOFfzmRSZXLA&utm_medium=api&utm_source=9b195f40&v=6BFD9D86A9D9C9FF7B318F26023F47D8311C8D92,,data science,Northern Ireland,adzuna,2025-05-20 17:50:04,Senior,993.0,1257,2
Data Scientist,Northern Ireland Audit Office,"Belfast, Northern Ireland",54.5975804,-5.9277097,"Northern Ireland Audit Office Data Scientist Job ref: DAT08/25 Job type: Contract Location: NIAO Salary: £46,229 to £48,418 (under review) Quantity of Posts Available: 1 Closing date: Thursday 29 May 2025 10:00 Job summary NIAO has a fixed term (12 months with a possibility of extension) opportunity available for a full-time Data Scientist .to cover a period of maternity leave (applications welcome for part-time hours minimum 30 hours per week, pro-rata salary). The role offers a salary of £46,…",45000.0,45000.0,https://www.adzuna.co.uk/jobs/details/5204005800?utm_medium=api&utm_source=9b195f40,,data science,Northern Ireland,adzuna,2025-05-20 17:50:04,Unknown,,1084,4
Senior Machine Learning Ops Engineer,DailyPay Inc,"Belfast, Northern Ireland",54.5975804,-5.9277097,"About Us: DailyPay is transforming the way people get paid. As a worktech company and the industry's leading on demand pay solution, DailyPay uses an award-winning technology platform to help America's top employers build stronger relationships with their employees. This voluntary employee benefit enables workers everywhere to feel more motivated to work harder and stay longer on the job while supporting their financial well-being outside of the workplace. DailyPay is headquartered in New York …",66383.88,66383.88,https://www.adzuna.co.uk/jobs/land/ad/5195443532?se=7Nsyepo18BGOFfzmRSZXLA&utm_medium=api&utm_source=9b195f40&v=D9DC5B6CE4007FD49FA749E9F211F5D8C12BA0EF,,data science,Northern Ireland,adzuna,2025-05-20 17:50:04,Senior,785.0,1084,2
Graduate/Junior AI Product Engineer,VANRATH,"Belfast, Northern Ireland",54.5975804,-5.9277097,"AI Product Engineer (Graduate / Early Career Role) Location: Belfast, hybrid (3 days a week) Type: Full-time, Entry-level Start Date: ASAP Are you a recent graduate or early-career software engineer with a passion for artificial intelligence, machine learning, and data science? Do you dream of building AI features that impact real users? Are you hungry to take ownership, experiment, and make a mark on an ambitious product? We're looking for a driven and passionate AI Product Lead to join our te…",35000.0,35000.0,https://www.adzuna.co.uk/jobs/land/ad/5187679083?se=7Nsyepo18BGOFfzmRSZXLA&utm_medium=api&utm_source=9b195f40&v=48F7CC4BCD183E6A5BDFB9DEDE4073DE38B83AA2,,data science,Northern Ireland,adzuna,2025-05-20 17:50:04,Graduate,660.0,1084,6
Data Engineer,Hayward Hawk,"Belfast, Northern Ireland",54.5975804,-5.9277097,"HAYWARD HAWK is excited to be working with a global tech leader that's expanding its Belfast office. Were helping them find a talented Data Engineer to join their growing data team. The Role: Youll build and maintain data pipelines, work with modern cloud tools, and help deliver reliable data to drive key business decisions. Its a hands-on role with plenty of variety and collaboration across teams. What Youll Be Doing: Building scalable data pipelines with modern ETL tools Managing cloud-based …",50000.0,50000.0,https://www.adzuna.co.uk/jobs/land/ad/5175373274?se=7Nsyepo18BGOFfzmRSZXLA&utm_medium=api&utm_source=9b195f40&v=E78F3B34BDCC2872D8FE3722759DF99220FE41AB,,data science,Northern Ireland,adzuna,2025-05-20 17:50:04,Unknown,678.0,1084,4
Data Analyst,HAYS Specialist Recruitment,"Belfast, Northern Ireland",54.5975804,-5.9277097,"We are working with a large public body to seek a highly skilled and motivated Data Analyst. The successful candidate will be responsible for the extraction, analysis, and presentation of data from complex databases and datasets. This role requires a strong analytical background and proficiency in using various analysis and query tools in a practical work environment. Key Responsibilities Extract data from complex databases/datasets using analysis and query tools. Analyse, interpret, and presen…",34242.0,34242.0,https://www.adzuna.co.uk/jobs/land/ad/5191611834?se=7Nsyepo18BGOFfzmRSZXLA&utm_medium=api&utm_source=9b195f40&v=E1206E4AE0A3569956ED57702D68B7B93BA51EFC,,data science,Northern Ireland,adzuna,2025-05-20 17:50:04,Mid-level,665.0,1084,1
Machine Learning Engineer,Enso Recruitment,"Belfast, Northern Ireland",54.5975804,-5.9277097,"Enso Recruitment is working on behalf of a client in the technology sector to hire a Machine Learning Engineer with a strong background in data analytics. This role offers the chance to apply advanced ML techniques to real-world challenges within the utilities sector, delivering meaningful outcomes through predictive analytics. The successful candidate will join a growing data and modelling team, contributing to a cloud-based platform used to monitor and forecast network performance. This is a …",50000.0,50000.0,https://www.adzuna.co.uk/jobs/land/ad/5204005791?se=7Nsyepo18BGOFfzmRSZXLA&utm_medium=api&utm_source=9b195f40&v=B95DC2C2126A93E8F452566BC1DE4390F29E1402,,data science,Northern Ireland,adzuna,2025-05-20 17:50:04,Unknown,674.0,1084,4
Data Engineer ( Python ),Ocho,"Belfast, Northern Ireland",54.5975804,-5.9277097,"Data Engineer (Python) Location: Belfast (Hybrid - 3 days/week on-site) Type: Full-time | Permanent The Opportunity We're hiring a Data Engineer with strong Python skills to support the evolution of a data platform within a global cybersecurity context. Sitting at the heart of a cross-functional data and customer success team, you'll build robust data pipelines, drive system integration's, and help unlock critical insights across the business. This is a hands-on engineering role where your abil…",45000.0,45000.0,https://www.adzuna.co.uk/jobs/land/ad/5207104871?se=7Nsyepo18BGOFfzmRSZXLA&utm_medium=api&utm_source=9b195f40&v=7459F0CCC5014784B5779D972053AB8614F77E88,,data science,Northern Ireland,adzuna,2025-05-20 17:50:04,Unknown,793.0,1084,4
Power Systems Engineer,Camlin,"Lisburn, Northern Ireland",54.510899,-6.04273,"Company Description: Camlin is a global technology leader that operates with the vision of bringing revolutionary products to life for a wide range of industries, including power and rail, and also has interests in a number of R&D projects in a variety of scientific sectors. At Camlin we believe in high quality engineering and design, allowing us to develop market leading products and services. In short, we love creating value for our customers by solving difficult problems. As of today, the Ca…",50000.0,50000.0,https://www.adzuna.co.uk/jobs/land/ad/5169935096?se=7Nsyepo18BGOFfzmRSZXLA&utm_medium=api&utm_source=9b195f40&v=6BC6BC2E21AC989428A4B8098EE855E515680906,,data science,Northern Ireland,adzuna,2025-05-20 17:50:04,Unknown,783.0,1127,4
Platform Engineer - Fully Remote,Realtime Recruitment,"Northern Ireland, UK",54.388189,-7.388242,"My client is a powerhouse in Fintech international design, & is seeking a Platform Engineer to build and maintain highly available cloud data applications. You'll collaborate with DevOps and Engineering to integrate these applications within Payroc's ecosystem. This role involves defining platform standards for smooth deployments, ensuring platform stability and scalability through upgrades, and managing the data analytics platform. Responsibilities: Utilize modern data platform tools (dbt Core…",64653.19,64653.19,https://www.adzuna.co.uk/jobs/land/ad/5179917852?se=7Nsyepo18BGOFfzmRSZXLA&utm_medium=api&utm_source=9b195f40&v=B28E35E432560672339580EBFC6B954CC1DE819C,,data science,Northern Ireland,adzuna,2025-05-20 17:50:04,Unknown,784.0,1089,4
Customer Success Lead,Neueda,"Belfast, Northern Ireland",54.5975804,-5.9277097,"We're looking for an experienced Customer Success Lead to join our fast-growing Business Development team. Occupation Hybrid Tenure Permanent/Full-Time Location Belfast/UK Salary Competitive About us Neueda is a leading provider of technical and professional learning solutions for market leading finance, insurance, and technology organisations. We have an ambitious vision for growth, supporting organisations on the journey to equipping their people with the skills to achieve and sustain transfo…",42356.62,42356.62,https://www.adzuna.co.uk/jobs/land/ad/5175373625?se=7Nsyepo18BGOFfzmRSZXLA&utm_medium=api&utm_source=9b195f40&v=AA5D322CB8C806E0B17B662C214BED4D55968184,,data science,Northern Ireland,adzuna,2025-05-20 17:50:04,Senior,795.0,1084,2
Customer success lead,Neueda,"Belfast, Northern Ireland",54.5975804,-5.9277097,"Location: Contract Type: Category: Date: Description We're looking for an experienced Customer Success Lead to join our fast-growing Business Development team. Occupation Hybrid Tenure Permanent/Full-Time Location Belfast/UK Salary Competitive About us Neueda is a leading provider of technical and professional learning solutions for market leading finance, insurance, and technology organisations. We have an ambitious vision for growth, supporting organisations on the journey to equipping their …",42439.31,42439.31,https://www.adzuna.co.uk/jobs/land/ad/5194330042?se=7Nsyepo18BGOFfzmRSZXLA&utm_medium=api&utm_source=9b195f40&v=8841B4B5002C37E51785C78EBE2BD2D9CC7C1CEA,,data science,Northern Ireland,adzuna,2025-05-20 17:50:04,Senior,795.0,1084,2
