title,company,location,latitude,longitude,description,salary_min,salary_max,redirect_url,created,search_query,search_location,source,date_downloaded,job_level,company_id,location_id,job_level_id
Customer Experience Specialist,Getronics,"Glasgow, Scotland",55.86026,-4.25596,"Getronics is a global leader in technology solutions with a team of over 4,000 colleagues in 22 centres, providing comprehensive end-to-end services across the globe. Our mission is to deliver and continually evolve reliable IT services and solutions to empower organisations to maximise their business potential. We have an exciting opportunity for a Customer Experience Analyst to join our team! What we can give you: 37.5-hour working week with flexible working options, giving you that much need…",39347.99,39347.99,https://www.adzuna.co.uk/jobs/land/ad/5170683627?se=BMn3bpo18BG7RWOSH3cHCQ&utm_medium=api&utm_source=9b195f40&v=5B67C06B9DAE6B5A5620D902E8C559B7A79A67B9,,data analyst,Scotland,adzuna,2025-05-20 17:49:44,Senior,643.0,1059,2
Data Engineer,Motability Operations,"Leith, Edinburgh",55.976756,-3.173158,"Description The D&BI team works on allowing integration, transformation and visualisation throughout MO, allowing the organisation to maximise on the power of its data. The successful candidate would be: Working in an agile scrum team to design and build data feeds and related applications Working with business users to design and configure self-serve data environments within our snowflake data lake, or on our AWS Native data science platform. Analysing, developing, delivering, and managing BI …",54337.99,54337.99,https://www.adzuna.co.uk/jobs/land/ad/5189857393?se=BMn3bpo18BG7RWOSH3cHCQ&utm_medium=api&utm_source=9b195f40&v=BE10E022FA7ABD35B26E3CCF955B71AC8BC8286F,,data analyst,Scotland,adzuna,2025-05-20 17:49:44,Unknown,606.0,1055,4
"Senior Project Administrator - Glasgow, Edinburgh",Hymans Robertson LLP,"Glasgow, Scotland",55.86026,-4.25596,"The Vacancy Our Third Party Administration (TPA) department is a dynamic administration team with a varied portfolio of clients. They play a key part in providing our clients and members with a market-leading service on Defined Benefits (DB), Defined Contribution (DC) and CARE pension arrangements. We currently have an exciting opportunity to join this department as an Administration Consulting Analyst, within our Data Journey team in our Edinburgh or Glasgow Office. The Data Journey Team lead …",28777.45,28777.45,https://www.adzuna.co.uk/jobs/land/ad/5162198667?se=BMn3bpo18BG7RWOSH3cHCQ&utm_medium=api&utm_source=9b195f40&v=3DB3FB59C1429225EDE2D6C00E0FF2B08661466B,,data analyst,Scotland,adzuna,2025-05-20 17:49:44,Senior,646.0,1059,2
Sustainability Information Analyst,Fife Council,"Glenrothes, Fife",56.197201,-3.1731,"Description Proposed Interview Date: Week Commencing Monday 23 June 2025 Closing Date: Wednesday 4 June 2025 Contract Type: Temporary for 2 years Salary: FC7 £32,437.03 - £40,358.57 Working Pattern: 36 hours per week Location: Fife House, Glenrothes Fife Council is committed to creating employment and training opportunities for the young people of Fife. This post is part of that commitment. This post is funded through the Workforce Youth Investment programme and therefore is restricted to appli…",32437.0,40358.0,https://www.adzuna.co.uk/jobs/details/5205150118?utm_medium=api&utm_source=9b195f40,,data analyst,Scotland,adzuna,2025-05-20 17:49:44,Mid-level,865.0,1154,1
Product Analyst,National Westminster Bank,"Edinburgh, Scotland",55.943116,-3.327942,"Join us as a Product Analyst Take on a new challenge and help us design, develop and launch new products You’ll be joining the Mettle Product team to support the delivery of product improvements to small business customers and colleagues We’ll look to you to support the team to prioritise the most impactful changes for customer and gather requirements for new feature delivery What you'll do In this role, you’ll work with Product Owners and their cross-functional squads to support prioritisation…",36028.15,36028.15,https://www.adzuna.co.uk/jobs/details/5203735111?utm_medium=api&utm_source=9b195f40,,data analyst,Scotland,adzuna,2025-05-20 17:49:44,Mid-level,754.0,1056,1
Administration Consulting Analyst - Edinburgh/ Glasgow,Hymans Robertson LLP,"Glasgow, Scotland",55.86026,-4.25596,"The Vacancy Our Third Party Administration (TPA) department is a dynamic administration team with a varied portfolio of clients. They play a key part in providing our clients and members with a market-leading service on Defined Benefits (DB), Defined Contribution (DC) and CARE pension arrangements. We currently have an exciting opportunity to join this department as an Administration Consulting Analyst, within our Data Journey team in our Birmingham, Edinburgh or Glasgow Office. What will your …",36504.05,36504.05,https://www.adzuna.co.uk/jobs/land/ad/5162198733?se=BMn3bpo18BG7RWOSH3cHCQ&utm_medium=api&utm_source=9b195f40&v=EFB341DE54D5121FA011AC063A6B32D84BB05D34,,data analyst,Scotland,adzuna,2025-05-20 17:49:44,Mid-level,646.0,1059,1
Principal Data Engineer,Aegon UK,"Edinburgh, Scotland",55.943116,-3.327942,"Job Description Summary Job Description Principal Data Engineer Permanent Location: Edinburgh or Witham (We believe in the power of in-person collaboration, and our hybrid model requires colleagues to be in the office a minimum of 40% of their time) Salary: A competitive salary from £57,600 - £86,400 , depending on the experience you can bring Closing date: 30th May 2025 We’re a company of ambitious, collaborative problem-solvers who get things done – we’re looking for like-minded people to joi…",74221.38,74221.38,https://www.adzuna.co.uk/jobs/details/5206000358?utm_medium=api&utm_source=9b195f40,,data analyst,Scotland,adzuna,2025-05-20 17:49:44,Senior,,1056,2
Senior Cyber Security Analyst,Scottish Government,"Glasgow, Scotland",55.86026,-4.25596,"Description We’re seeking a Senior Cyber Security Analyst to join our team in the Digital Risk and Security Branch. The ideal candidate will bring hands-on experience with vulnerability Management and strong familiarity with Identity and Access Management (IAM) in any major cloud platform (AWS, Azure, or GCP). On a day-to-day basis, will monitor, analyse and respond to security intel to reduce risks within IAM, and Vulnerability Management. Support IAM and Vulnerability Management practices and…",39252.34,39252.34,https://www.adzuna.co.uk/jobs/details/5196563367?utm_medium=api&utm_source=9b195f40,,data analyst,Scotland,adzuna,2025-05-20 17:49:44,Senior,649.0,1059,2
Senior Data Analyst,Archer - The IT Recruitment Consultancy,"Wales, UK",52.195902,-3.747508,"Senior Data Analyst Fully Remote! Clear Progression to Principal! Enjoy Global Recognition Working for a Multinational Org! Are you an experienced Senior Data Analyst ? Do you go far beyond the basic requirements of Gathering Requirements and Building Dashboards ? Have you ever imagined yourself working at a highly competitive, rapidly growing company? Well, you may have just found the opportunity you’ve been longing for. Have you mastered the use of tools such as SQL, Looker, Tableau and Power…",51948.56,51948.56,https://www.adzuna.co.uk/jobs/land/ad/5199580335?se=zGLRb5o18BG7RWOSH3cHCQ&utm_medium=api&utm_source=9b195f40&v=8AF8CA8DE38609C529664D95A024AF2BD69B7DA4,,data analyst,Wales,adzuna,2025-05-20 17:49:46,Senior,,1294,2
DATA ANALYST,Wrexham AFC,"Wrexham, Wales",53.046902,-2.99167,"Job Purpose To play a key role in the development of Wrexham AFC Medical Performance team, helping to develop strategies and practices to enhance performance programming and player development. The role will work collaboratively across sports science, performance and medical to help develop a ‘best in class’, performance department. Main Responsibilities Lead on GPS data collection post training, games and matchdays and presenting this visually to management, players and performance department.…",25904.19,25904.19,https://www.adzuna.co.uk/jobs/details/5207659809?utm_medium=api&utm_source=9b195f40,,data analyst,Wales,adzuna,2025-05-20 17:49:46,Senior,,1372,2
Master Data Analyst,Amcor,"Swansea, Wales",51.620399,-3.94663,"Back to search results Master Data Analyst Location: Swansea, GB Function: Information Technology Part-time or Full-time: Full-Time Job Type: Employee Workplace type: On site Accelerate the possible by joining a winning Amcor team that’s transforming the packaging industry and improving lives around the world. At Amcor, we unpack possibility through our innovative and responsible packaging to provide solutions that benefit our customers, our people and our planet. More than 10,000 consumers wor…",42033.42,42033.42,https://www.adzuna.co.uk/jobs/details/5199595843?utm_medium=api&utm_source=9b195f40,,data analyst,Wales,adzuna,2025-05-20 17:49:46,Mid-level,,1078,1
Senior Data Governance Analyst,Ofgem,"Cardiff, Cardiff County",51.4813,-3.1805,"Length of employment: Job Summary: Are you passionate about data quality, governance, and driving cultural change in how data is managed and used? Join Ofgem's Markets Data Management Office (MDMO) and play a key role in embedding a robust Data Governance Framework across the Markets Group. In this pivotal role, you'll support the implementation of data governance policies, processes, and standards that enhance the quality, value, and usability of Markets data. Reporting to the Deputy Director,…",45998.07,45998.07,https://www.adzuna.co.uk/jobs/details/5206954382?utm_medium=api&utm_source=9b195f40,,data analyst,Wales,adzuna,2025-05-20 17:49:46,Senior,,1075,2
Junior Data Consultant,Sparta Global Limited,"Cardiff County, Wales",51.503169,-3.1785765,"About Sparta Global Embark on a transformative career journey with Sparta Global, where diversity, innovation, and passion for technology converge. We welcome individuals from all backgrounds, offering not just jobs, but dynamic careers in the tech industry. You'll work alongside enthusiastic professionals, receiving top-tier training and mentorship to hone your skills for success in both public and private sectors. Our commitment to designing impactful careers and coaching future leaders is ev…",24000.0,24000.0,https://www.adzuna.co.uk/jobs/land/ad/5197561533?se=zGLRb5o18BG7RWOSH3cHCQ&utm_medium=api&utm_source=9b195f40&v=D4F151A316FBFDB89C9A938E3DEEA59B8FEDB674,,data analyst,Wales,adzuna,2025-05-20 17:49:46,Junior,985.0,1077,5
Technical Solutions Specialist,Creditsafe,"Cardiff County, Wales",51.503169,-3.1785765,"We are currently looking for a Technical Data Analyst to join our team in the Cardiff office. You will be expected to attend the office 50% of the working week, to align with our hybrid working policy. WHO ARE WE? At Creditsafe, we weave our core values of customer-obsession, trust, respect and the courage to be different into the very fabric of our culture. With these values, we’ve fostered a culture of growth, innovation, well-being and success for the last 20 years at Creditsafe and created …",58827.44,58827.44,https://www.adzuna.co.uk/jobs/land/ad/5166325876?se=zGLRb5o18BG7RWOSH3cHCQ&utm_medium=api&utm_source=9b195f40&v=0BF65FA9810929F6ECE59F731B177EE7E09202DD,,data analyst,Wales,adzuna,2025-05-20 17:49:46,Senior,656.0,1077,2
Data Engineer,Creditsafe,"Cardiff County, Wales",51.503169,-3.1785765,"We are currently looking a Data Engineer, to join the Data Engineering team in Cardiff. You will be expected to attend the office 50% of the working week, to align with our hybrid working policy. WHO ARE WE? At Creditsafe, we weave our core values of customer-obsession, trust, respect and the courage to be different into the very fabric of our culture. With these values, we’ve fostered a culture of growth, innovation, well-being and success for the last 20 years at Creditsafe and created a lega…",41911.57,41911.57,https://www.adzuna.co.uk/jobs/land/ad/5166322381?se=zGLRb5o18BG7RWOSH3cHCQ&utm_medium=api&utm_source=9b195f40&v=D2DE7D12C731EC95D23095A5476BB1EB16200EC9,,data analyst,Wales,adzuna,2025-05-20 17:49:46,Unknown,656.0,1077,4
Business Data Analyst,HAYS,"Belfast, Northern Ireland",54.5975804,-5.9277097,"We are working with a global financial institution to recruit a Business Data Analyst to join their project execution team. This role is crucial for ensuring timely execution of Price Risk deliverables, leveraging expertise in business analysis, project execution, and delivery, with a focus on trade population control and data quality. Key Responsibilities Drive execution of the Price Risk Data regulatory book of work. Enhance controls for trade population completeness and CDE data quality. Per…",36127.41,36127.41,https://www.adzuna.co.uk/jobs/land/ad/5169310579?se=zNP6cJo18BG7RWOSH3cHCQ&utm_medium=api&utm_source=9b195f40&v=604FCB41B1F67258E9969122F2B32DAAD633F8DD,,data analyst,Northern Ireland,adzuna,2025-05-20 17:49:49,Mid-level,560.0,1084,1
Data Analyst,HAYS Specialist Recruitment,"Belfast, Northern Ireland",54.5975804,-5.9277097,"We are working with a large public body to seek a highly skilled and motivated Data Analyst. The successful candidate will be responsible for the extraction, analysis, and presentation of data from complex databases and datasets. This role requires a strong analytical background and proficiency in using various analysis and query tools in a practical work environment. Key Responsibilities Extract data from complex databases/datasets using analysis and query tools. Analyse, interpret, and presen…",34242.0,34242.0,https://www.adzuna.co.uk/jobs/land/ad/5191611834?se=zNP6cJo18BG7RWOSH3cHCQ&utm_medium=api&utm_source=9b195f40&v=E1206E4AE0A3569956ED57702D68B7B93BA51EFC,,data analyst,Northern Ireland,adzuna,2025-05-20 17:49:49,Mid-level,665.0,1084,1
Data Analyst (Finance),VANRATH,"Newtownards, Ards",54.595001,-5.70311,"Are you an experienced Data Analyst with experience of working in a Finance role, specifically looking to join a public sector employer for an initial period of 3 months? Immediate start available! Salary/ Benefits In order to attract the very best talent on the market a generous remuneration package is on offer based on experience plus a range of benefits including: Immediate start Hybrid working Joining a recognisable employer Client A leading public sector organisation based in Newtownards a…",30000.0,30000.0,https://www.adzuna.co.uk/jobs/land/ad/5195443289?se=zNP6cJo18BG7RWOSH3cHCQ&utm_medium=api&utm_source=9b195f40&v=0D9A6C8F32567B54CCCA324199701EA5A75F2515,,data analyst,Northern Ireland,adzuna,2025-05-20 17:49:49,Mid-level,660.0,1085,1
Data Analyst/Administrator,HAYS Specialist Recruitment,"Belfast, Northern Ireland",54.5975804,-5.9277097,"Data Analyst Role Overview: A prestigious organisation is seeking a dedicated Systems Administrator to support the Group Systems Manager in maintaining and enhancing a diverse range of applications. This role involves working with mobile platforms, CAFM systems, document management systems, reporting applications, and finance packages. Additionally, the position includes IT support and operational tasks, with occasional travel to other offices within the UK and Responsibilities: The Systems Ana…",35000.0,35000.0,https://www.adzuna.co.uk/jobs/land/ad/5189663375?se=zNP6cJo18BG7RWOSH3cHCQ&utm_medium=api&utm_source=9b195f40&v=EBC09C4068E64B8AA4CA4CCD5CB43DE2A557E818,,data analyst,Northern Ireland,adzuna,2025-05-20 17:49:49,Senior,665.0,1084,2
Data Analyst - Band 5,Adecco UK Limited,"Newtownards, Ards",54.595001,-5.70311,"Data Analyst in Healthcare Are you passionate about transforming data into actionable insights? Join our dynamic team as a Data Analyst and make a real impact in the healthcare sector! Position: Data Analyst Salary: £27,055 - £32,934 per annum Location: Ards Community Hospital Working Pattern: Full Time Driving Required: Yes What You'll Do: Operational Delivery: Assist in producing accurate and timely costing information for hospital and community sectors, ensuring relevance and accessibility f…",28000.0,28000.0,https://www.adzuna.co.uk/jobs/land/ad/5195443449?se=zNP6cJo18BG7RWOSH3cHCQ&utm_medium=api&utm_source=9b195f40&v=7E868ADD91994E671CBD08762CA7A011AFC4AD70,,data analyst,Northern Ireland,adzuna,2025-05-20 17:49:49,Mid-level,668.0,1085,1
Data Analyst - Market Risk Controls (BELFAST),McGregor Boyall Associates Limited,"Belfast, Northern Ireland",54.5975804,-5.9277097,"Role: Data Analyst - Market Risk Controls Rate: £600.00 per day (Inside IR35, via Umbrella) Length: 6 months, until 31/12/2025 Location: Belfast (Hybrid, 2 to 3 days per week in office) We're supporting a leading investment bank as they build out the control framework for their strategic data platform within Market Risk. This sits within a wider transformation programme focused on improving the quality, traceability and control of risk data. This role would suit someone who enjoys getting into …",143000.0,156000.0,https://www.adzuna.co.uk/jobs/land/ad/5173067947?se=zNP6cJo18BG7RWOSH3cHCQ&utm_medium=api&utm_source=9b195f40&v=C03CA5D4942B6FECF1738817470D0563BF21CC5D,,data analyst,Northern Ireland,adzuna,2025-05-20 17:49:49,Mid-level,661.0,1084,1
Senior Data Analyst,Archer - The IT Recruitment Consultancy,"Northern Ireland, UK",54.388189,-7.388242,"Senior Data Analyst Fully Remote! Clear Progression to Principal! Enjoy Global Recognition Working for a Multinational Org! Are you an experienced Senior Data Analyst ? Do you go far beyond the basic requirements of Gathering Requirements and Building Dashboards ? Have you ever imagined yourself working at a highly competitive, rapidly growing company? Well, you may have just found the opportunity you’ve been longing for. Have you mastered the use of tools such as SQL, Looker, Tableau and Power…",49719.84,49719.84,https://www.adzuna.co.uk/jobs/land/ad/5199579703?se=zNP6cJo18BG7RWOSH3cHCQ&utm_medium=api&utm_source=9b195f40&v=F7802FADDD85FE96096EBE2BACAFAEDA92654519,,data analyst,Northern Ireland,adzuna,2025-05-20 17:49:49,Senior,,1089,2
"Senior Data Analyst - Python, SQL, Trading",Harvey Nash,"Belfast, Northern Ireland",54.5975804,-5.9277097,"Senior Data Analyst - Python, SQL, Trading sought by leading investment bank based in Belfast. Inside IR35 - Min 3 days a week on site in Belfast  Looking for a data analyst hand-on with SQL, Python, can source data. Also should have experience to trades and positions data and basic knowledge of some products from any asset class namely, Rates, Equities, FX, Commodities etc. Experience to Market Risk and Finance is addon. Primary Responsibilities: Support the Program Initiative lead(s) to drive…",143000.0,162500.0,https://www.adzuna.co.uk/jobs/land/ad/5199047368?se=zNP6cJo18BG7RWOSH3cHCQ&utm_medium=api&utm_source=9b195f40&v=03D97D623038C40D68BF0AD344156C02CA886C2F,,data analyst,Northern Ireland,adzuna,2025-05-20 17:49:49,Senior,125.0,1084,2
Data Analyst - Market Risk Controls (BELFAST),McGregor Boyall,"Belfast, Northern Ireland",54.5975804,-5.9277097,"Role:Data Analyst - Market Risk Controls Rate:s £600.00 per day (Inside IR35, via Umbrella Length:a) 6 months, until 31/12/20 Location:025 Belfast (Hybrid, 2 to 3 days per week in office) We're supporting a leading investment bank as they build out the control framework for their strategic data platform within Market Risk. This sits within a wider transformation programme focused on improving the quality, traceability and control of risk data. This role would suit someone who enjoys getting int…",60966.56,60966.56,https://www.adzuna.co.uk/jobs/land/ad/5187679297?se=zNP6cJo18BG7RWOSH3cHCQ&utm_medium=api&utm_source=9b195f40&v=73DBDE2A5924E8EB44D1850F217E39BE451E410B,,data analyst,Northern Ireland,adzuna,2025-05-20 17:49:49,Mid-level,99.0,1084,1
Data Analyst,Hays Technology,"County Antrim, Northern Ireland",54.8647255,-6.1436379,"We are working with a large public body to seek a highly skilled and motivated Data Analyst. The successful candidate will be responsible for the extraction, analysis, and presentation of data from complex databases and datasets. This role requires a strong analytical background and proficiency in using various analysis and query tools in a practical work environment. Key Responsibilities Extract data from complex databases/datasets using analysis and query tools. Analyse, interpret, and presen…",33565.6,33565.6,https://www.adzuna.co.uk/jobs/land/ad/5191260025?se=zNP6cJo18BG7RWOSH3cHCQ&utm_medium=api&utm_source=9b195f40&v=D285CE71DC5C8B5BD6BAE45ACF00A4F14CEB91CA,,data analyst,Northern Ireland,adzuna,2025-05-20 17:49:49,Mid-level,663.0,1087,1
Data Analyst,Blue Arrow,"Newtownards, Ards",54.595001,-5.70311,"Job role: Data Analyst Location: Newtownards Duration: 3 months min Pay rate: £15.36 Hours: Full time, Monday -Friday, 9-5pm onsite (some flexibility may be allowed once fully competent) Your role: You will assist in the provision of costing and benchmarking information to support decision making within the Trust, collating, analysing, interpreting, and presenting high quality information, considering the use of new technologies, to improve usability and accessibility of information for non-fin…",29350.0,29350.0,https://www.adzuna.co.uk/jobs/land/ad/5195443491?se=zNP6cJo18BG7RWOSH3cHCQ&utm_medium=api&utm_source=9b195f40&v=B1EF7375C76B2A69B560D47D608AE939391A06E3,,data analyst,Northern Ireland,adzuna,2025-05-20 17:49:49,Mid-level,666.0,1085,1
Data Analyst,HAYS Specialist Recruitment,"Banbridge, County Down",54.351002,-6.26702,"An exciting opportunity has arisen for a motivated and highly organised Field View Administrator to join a leading company in the UK and Ireland's Building Services sector. This role involves supporting our teams through the efficient use of Viewpoint's Field View software, ensuring that information is collected and distributed according to company standards. Key Responsibilities: Configure and maintain Field View templates, workflows, forms, tasks, and user permissions to suit project requirem…",28000.0,28000.0,https://www.adzuna.co.uk/jobs/land/ad/5197170486?se=zNP6cJo18BG7RWOSH3cHCQ&utm_medium=api&utm_source=9b195f40&v=EA350C42EFF2E9F153B606C9A13070E256CD0B93,,data analyst,Northern Ireland,adzuna,2025-05-20 17:49:49,Mid-level,665.0,1254,1
Business Data Analyst,Hays Technology,"County Antrim, Northern Ireland",54.8647255,-6.1436379,"We are working with a global financial institution to recruit a Business Data Analyst to join their project execution team. This role is crucial for ensuring timely execution of Price Risk deliverables, leveraging expertise in business analysis, project execution, and delivery, with a focus on trade population control and data quality. Key Responsibilities Drive execution of the Price Risk Data regulatory book of work. Enhance controls for trade population completeness and CDE data quality. Per…",34910.66,34910.66,https://www.adzuna.co.uk/jobs/land/ad/5169323738?se=zNP6cJo18BG7RWOSH3cHCQ&utm_medium=api&utm_source=9b195f40&v=A284A1C86227F46738A17E49C680CA2A75B45F67,,data analyst,Northern Ireland,adzuna,2025-05-20 17:49:49,Mid-level,663.0,1087,1
Business Data Analyst,HAYS Specialist Recruitment,"Belfast, Northern Ireland",54.5975804,-5.9277097,"We are working with a global financial institution to recruit a Business Data Analyst to join their project execution team. This role is crucial for ensuring timely execution of Price Risk deliverables, leveraging expertise in business analysis, project execution, and delivery, with a focus on trade population control and data quality. Key Responsibilities Drive execution of the Price Risk Data regulatory book of work. Enhance controls for trade population completeness and CDE data quality. Per…",127185.0,127185.0,https://www.adzuna.co.uk/jobs/land/ad/5169935800?se=zNP6cJo18BG7RWOSH3cHCQ&utm_medium=api&utm_source=9b195f40&v=3AC00B14DF86E722408AC0EA6BEC2C05A4CA8376,,data analyst,Northern Ireland,adzuna,2025-05-20 17:49:49,Mid-level,665.0,1084,1
Business Data Analyst BELFAST £600/day Banking,Adecco,"County Antrim, Northern Ireland",54.8647255,-6.1436379,"Business Data Analyst | BELFAST| £600/day Inside IR35 | Hybrid 3 days a week in the office 2 days work from home | Banking | Wholesale Payments | Our Belfast based client is seeking an seasoned Business Data Analyst with experience and knowledge the life cycle of wholesale payments. Knowledge of the financial markets, risk and controls, wholesale payments life cycle, with a background in Investment Banking / Big 4 would be highly desirable. Your Essential Experience: 10  years' relevant experie…",156000.0,156000.0,https://www.adzuna.co.uk/jobs/land/ad/5189482433?se=zNP6cJo18BG7RWOSH3cHCQ&utm_medium=api&utm_source=9b195f40&v=0A5B7009062D0A461F3199E8244BDA066A822C72,,data analyst,Northern Ireland,adzuna,2025-05-20 17:49:49,Mid-level,669.0,1087,1
Business Data Analyst BELFAST £600/day Banking,Adecco,"County Antrim, Northern Ireland",54.8647255,-6.1436379,"Business Data Analyst | BELFAST| £600/day Inside IR35 | Hybrid 3 days a week in the office 2 days work from home | Banking | Our Belfast based client is seeking an seasoned Business Data Analyst with experience and knowledge in trade population control framework and data quality controls. Knowledge of the financial markets, risk and controls, and a working knowledge of key regulatory initiatives impacting Markets from a background within Investment Banking / Big 4 would be highly desirable. You…",156000.0,156000.0,https://www.adzuna.co.uk/jobs/land/ad/5176432993?se=zNP6cJo18BG7RWOSH3cHCQ&utm_medium=api&utm_source=9b195f40&v=B1D293EC6480F70E034F56B261FBD654BC0EFE12,,data analyst,Northern Ireland,adzuna,2025-05-20 17:49:49,Mid-level,669.0,1087,1
