title,company,location,latitude,longitude,description,salary_min,salary_max,redirect_url,created,search_query,search_location,source,date_downloaded,job_level,min_outlier,max_outlier
"Senior Business Analyst, Data",Arc IT Recruitment,EC1V0AA,51.523383,-0.100112,"Senior Business Analyst, Data To 85K bonus &amp; benefits London, hybrid Senior Business Analyst is sought by global and highly prestigious insurance group to join its fast-moving and cutting-edge data function. This role sits within a team responsible for driving data-led transformation, delivering scalable solutions and supporting business-wide strategy through insightful analysis and effective stakeholder engagement. This role will see you wo... ",85000.0,85000.0,https://www.reed.co.uk/jobs/senior-business-analyst-data/54760937,01/04/2025,data analyst,England,reed,2025-04-22 18:37:03,Senior,True,False
Data & AI Product Manager,Harnham - Data & Analytics Recruitment,London,51.5074456,-0.1277653,"DATA &amp; AI PRODUCT MANAGER UP TO 120,000 HYBRID - LONDON - 2-3X A WEEK *Please note, this company is unable to offer sponsorship at this time and you must be a UK resident* THE COMPANY Join this professional services firm to take ownership of high-value initiatives, working closely with senior stakeholders and cross-functional teams to deliver impactful solutions. THE ROLE You will act as the key point of contact for stakeholders, including t... ",100000.0,120000.0,https://www.reed.co.uk/jobs/data-ai-product-manager/54626811,11/03/2025,data analyst,England,reed,2025-04-22 18:37:03,Senior,True,True
AI Engineer,Harnham - Data & Analytics Recruitment,Manchester,53.4794892,-2.2451148,"AI Engineer / ML Engineer - CRYPTO - REMOTE We are collaborating with a cryptocurrency analytics firm that assists clients in identifying market opportunities, conducting due diligence, and protecting portfolios. The company is expanding its strategic capabilities in AI &amp; ML. They are seeking a skilled and driven Senior AI/ML Engineer to join their team. In this position, you will design and manage AI models to process extensive blockchain d... ",130000.0,150000.0,https://www.reed.co.uk/jobs/ai-engineer/54627833,11/03/2025,data analyst,remote,reed,2025-04-22 18:37:06,Senior,True,True
Senior Salesforce Administrator / Senior Sales Ops Analyst,Robert Half,Bristol,51.4538022,-2.5972985,"Robert Half have partnered with a global EdTech organisation looking to enhanced their Sales Operations function with the addition of a remote Senior Sales Operations Analyst / Senior Salesforce Administrator to cover European working hours for the organisation. Key Responsibilities Collaborate with cross-functional stakeholders from Sales, Pricing, FP&amp;A, Order Management, Channel, IT, and fellow Sales Operations team members Self-manage to ... ",70000.0,100000.0,https://www.reed.co.uk/jobs/senior-salesforce-administrator-senior-sales-ops-analyst/54872851,22/04/2025,data analyst,remote,reed,2025-04-22 18:37:06,Senior,False,True
Risk Business Analyst Team Lead,INTEC SELECT LIMITED,EC3N2EX,51.512554,-0.076884,"Risk Business Analyst Team Lead – Financial Services – Up to 110k – City of London - Hybrid Overview: We are currently partnered with one of the world’s leading financial institutions who are seeking an experienced Risk Business Analyst Team Lead to join their Technology Innovation Management team. This is a high-impact role where you will be accountable for overseeing the Risk portfolio, leading a team of consultants and permanent staff, and en... ",100000.0,110000.0,https://www.reed.co.uk/jobs/risk-business-analyst-team-lead/54642846,13/03/2025,data analyst,remote,reed,2025-04-22 18:37:06,Senior,True,True
Pensions vacancies - various levels,Profile Search & Selection Ltd,Leeds,53.7974185,-1.5437941,"If you are currently seeking a technical role within Pensions or seeking assistance with a current vacancy we are awaiting your call !! Just an informal chat at this stage is all we need to assess whether we can assist. Lisa Tremlett &amp; Juliette Lister have over thirty years recruitment experience to the Pensions profession. Profile provides expert assistance in the recruitment of experienced personnel to Third Party Pensions Companies, In-ho... ",25000.0,100000.0,https://www.reed.co.uk/jobs/pensions-vacancies-various-levels/54496069,18/02/2025,data analyst,remote,reed,2025-04-22 18:37:06,Senior,False,True
Account Executive,Walsh Employment,Frankfurt,50.1106444,8.6820917,"Account Executive Location: Frankfurt, Germany - hybrid role working from home 2 days per week. Salary: €75-85K base with €150-170K OTE plus excellent benefits package. Our client is a global technology company leading the way in continuous testing and quality engineering . Their AI-powered platform offers a fully automated, codeless solution for enterprise software testing, helping organisations accelerate digital transformation by improving re... ",150000.0,170000.0,https://www.reed.co.uk/jobs/account-executive/54745996,31/03/2025,data analyst,remote,reed,2025-04-22 18:37:06,Unknown,True,True
AI & Tech Lead,Reed.co.uk,WC2B5LX,51.516485,-0.121918,"Build the Future of AI Recruitment with us! Do you have a passion for AI, technical leadership, and building scalable, high-impact products? We're looking for a Lead AI &amp; Tech Architect to ensure the success of our cutting-edge AI recruitment platform. Overview This is a unique opportunity to take ownership of a high-profile AI-powered recruitment solution, ensuring its scalability, security, and long-term innovation. You'll play a pivotal r... ",90000.0,90000.0,https://www.reed.co.uk/jobs/ai-tech-lead/54816674,09/04/2025,data science,England,reed,2025-04-22 18:37:11,Senior,True,False
AI & Technology Lead,Reed.co.uk,WC2B5LX,51.516485,-0.121918,"Build the Future of AI Recruitment with us! Do you have a passion for AI, technical leadership, and building scalable, high-impact products? We’re looking for a Lead AI &amp; Tech Architect to ensure the success of our cutting-edge AI recruitment platform. Overview This is a unique opportunity to take ownership of a high-profile AI-powered recruitment solution, ensuring its scalability, security, and long-term innovation. You’ll play a pivotal r... ",90000.0,90000.0,https://www.reed.co.uk/jobs/ai-technology-lead/54770405,02/04/2025,data science,England,reed,2025-04-22 18:37:11,Senior,True,False
AI Financial Controller,ADSM PLC,SL46AF,51.487082,-0.609212,"Job Title: Financial Controller Location: Hybrid Salary: 90-120k Reports to: Director Team: 4-5 direct reports Company Overview: At Advanced Demand-Side Management (ADSM), we’re not just shaping the future of water management; we’re revolutionizing it with cutting-edge technology and AI-driven solutions. As a high-tech business in the utilities sector, we leverage the latest innovations to create efficiency and drive results. We are now seeking ... ",90000.0,120000.0,https://www.reed.co.uk/jobs/ai-financial-controller/54825279,10/04/2025,data science,England,reed,2025-04-22 18:37:11,Senior,True,True
Data Architect,N Brown Group,M606ES,53.482993,-2.232328,"We’re looking for a Data Architect to join our architecture chapter here at N Brown Group! &nbsp; What will you do as a Data Architect at N Brown?&nbsp; Designing solutions to meet customer needs. This will be end to end and take advantage of key frameworks that are part of our wider strategy. From data visualisation, analytical requirements, and machine learning needs to ingestion of new sources.&nbsp; Work collaboratively with teams to create,... ",90000.0,90000.0,https://www.reed.co.uk/jobs/data-architect/54797799,07/04/2025,data science,England,reed,2025-04-22 18:37:11,Senior,True,False
Data Governance Lead,Chambers and Partners,EC4A2AE,51.514302,-0.10848,"Salary: 85,000 basic Location: London (Hybrid) Job Description: We are seeking an experienced Data Governance Lead to join Chambers and Partners, the world's leading provider of legal research and analysis. Reporting to the Chief Data Officer, you will play a pivotal role in maximizing the quality, usability, and commercial value of our strategic data assets, whilst ensuring regulatory compliance. You will lead the governance programme implement... ",85000.0,85000.0,https://www.reed.co.uk/jobs/data-governance-lead/54844999,15/04/2025,data science,England,reed,2025-04-22 18:37:11,Senior,True,False
Data Scientist,Profile 29,W1S3DN,51.509916,-0.138487,"Job: Data Scientist (London W1) Salary to 120k Benefits; pension, stock options*, free in-office lunches Location; Mon-Fri onsite in London W1 offices (Piccadilly Circus) Company Having recently floated on *NASDAQ, this company is a dynamic, AI-first SaaS company known for leveraging the latest advancements in Generative AI to deliver world-class Ai commerce solutions. Recognized by industry leaders, they are in an exciting growth phase and seek... ",100000.0,120000.0,https://www.reed.co.uk/jobs/data-scientist/54659222,17/03/2025,data science,England,reed,2025-04-22 18:37:11,Unknown,True,True
Data Scientist,Harnham - Data & Analytics Recruitment,London,51.5074456,-0.1277653,"Contract Data Scientist - Graph Theory &amp; Household Propensity Modelling Gaming &amp; Gambling Sector | Remote UK | 500-550/day Outside IR35 We're working with a leading gaming &amp; gambling business looking to hire a contract Data Scientist with experience in Graph Theory and Household Propensity Modelling. You'll be joining a high-performing data science team focused on customer behaviour, player interaction modelling, and personalisation ... ",100000.0,100000.0,https://www.reed.co.uk/jobs/data-scientist/54831071,11/04/2025,data science,England,reed,2025-04-22 18:37:11,Unknown,True,True
Head of Data Science,Harnham - Data & Analytics Recruitment,London,51.5074456,-0.1277653,"HEAD OF DATA SCIENCE UP TO 140,000 LONDON This is an exciting opportunity to join a rapidly growing fin-tech looking for a talented individual to head up their data science function and someone who can work cross functionally across the business. THE COMPANY This business is a growing car finance lender, who have recently raised over 150 million and are backed by some of the world's leading investors. THE ROLE You can expect to be involved in th... ",100000.0,140000.0,https://www.reed.co.uk/jobs/head-of-data-science/54859888,17/04/2025,data science,England,reed,2025-04-22 18:37:11,Senior,True,True
Head of Data Science,Harnham - Data & Analytics Recruitment,London,51.5074456,-0.1277653,"HEAD OF DATA SCIENCE LONDON UP TO 140,000 Join a fast-growing fintech revolutionising the way people finance their vehicles. Backed by leading investors and already serving thousands of happy customers, they're scaling fast and building a category-defining platform. As the first Head of Data Science, you'll take full ownership of the data science roadmap. From credit risk modelling and pricing optimisation to fraud detection and customer behavio... ",100000.0,140000.0,https://www.reed.co.uk/jobs/head-of-data-science/54859895,17/04/2025,data science,England,reed,2025-04-22 18:37:11,Senior,True,True
Head of Data Science,Harnham - Data & Analytics Recruitment,London,51.5074456,-0.1277653,"Head of Data Science Up to 140,000 London Hybrid I am currently hiring for a top consumer lending fintech based in London. They are looking to bring in a top leader in data science function to come into the business and spearhead the Fraud, Credit Risk, and Customer Analytics modelling for the business to support rapid growth. The Role: Developing new models for Credit risk decisioning/developing scorecard models using SQL, Python, and Snowflake... ",120000.0,140000.0,https://www.reed.co.uk/jobs/head-of-data-science/54860072,17/04/2025,data science,England,reed,2025-04-22 18:37:11,Senior,True,True
Senior Data Scientist,Rise Technical Recruitment Limited,London,51.5074456,-0.1277653,"Senior Data Scientist London - 4 Days on-site 65,000 - 110,000 DOE Generous Equity Unlimited Holiday This is an excellent opportunity for a Senior Data Scientist to join a rapidly growing start-up, where you will focus on analytics and modelling to interpret data. This company is a platform designed to simplify the hiring process for businesses and enable individuals to find flexible work opportunities. By connecting businesses with skilled prof... ",65000.0,110000.0,https://www.reed.co.uk/jobs/senior-data-scientist/54788992,04/04/2025,data science,England,reed,2025-04-22 18:37:11,Senior,False,True
Senior Data Scientist,Lorien,London,51.5074456,-0.1277653,"Senior Data Scientist: My client, an innovative Sports Analytics company in London, are seeking an exceptional Senior Data Scientist, with experience of working within a sports/betting domain. The Senior Data Scientist, must have proven expertise in sports modelling to lead projects that improve my clients current production models, whilst developing new markets for a range of different sports. The Senior Data Scientist will lead the development... ",90000.0,100000.0,https://www.reed.co.uk/jobs/senior-data-scientist/54743768,31/03/2025,data science,England,reed,2025-04-22 18:37:11,Senior,True,True
Bayesian Data Scientist,Robert Walters,London,51.5074456,-0.1277653,"Our client is revolutionising healthcare for millions of patients worldwide. They are at the forefront of wearable technology, connecting patients and physicians with continuous, data-driven dialogue. This unique position offers daily directed guidance that redefines primary care while helping people live happier, healthier, and longer lives. They are looking for a passionate Data Scientist to develop impactful healthcare solutions using wearabl... ",80000.0,120000.0,https://www.reed.co.uk/jobs/bayesian-data-scientist/54851498,16/04/2025,data science,England,reed,2025-04-22 18:37:11,Unknown,False,True
AI Engineer,Ronald James,NG11AA,52.955007,-1.141046,"We are seeking an experienced AI Engineer who has built software products. We're looking to enhance our technology products with advanced AI solutions. In this role, you will bridge AI research and practical application, collaborating with cross-functional teams to design and deploy AI features that elevate user experiences. Key Responsibilities: AI Integration: Develop and embed AI models into our products, ensuring scalability and efficiency. ... ",75000.0,110000.0,https://www.reed.co.uk/jobs/ai-engineer/54686466,21/03/2025,data science,England,reed,2025-04-22 18:37:11,Mid-level,False,True
AI Engineer,Harnham - Data & Analytics Recruitment,Manchester,53.4794892,-2.2451148,"AI Engineer / ML Engineer - CRYPTO - REMOTE We are collaborating with a cryptocurrency analytics firm that assists clients in identifying market opportunities, conducting due diligence, and protecting portfolios. The company is expanding its strategic capabilities in AI &amp; ML. They are seeking a skilled and driven Senior AI/ML Engineer to join their team. In this position, you will design and manage AI models to process extensive blockchain d... ",130000.0,150000.0,https://www.reed.co.uk/jobs/ai-engineer/54627833,11/03/2025,data science,England,reed,2025-04-22 18:37:11,Senior,True,True
Head of Data Science & Analytics,Harnham - Data & Analytics Recruitment,London,51.5074456,-0.1277653,"Head of Data Science &amp; Analytics Circa 125k (Dependent upon experience) Central London- Hybrid- 3 Days in the Office A strategy consultancy is looking for a Head of Data Science and Analytics to manage associate directors and lead analysts/data scientists/data engineers. THE COMPANY This company is a well-known strategy consultancy with a global presence and works across all industries (including healthcare, media, retail etc). ROLE In this ... ",120000.0,132000.0,https://www.reed.co.uk/jobs/head-of-data-science-analytics/54725888,27/03/2025,data science,England,reed,2025-04-22 18:37:11,Senior,True,True
Head of Analytics & Data Science,Harnham - Data & Analytics Recruitment,London,51.5074456,-0.1277653,"Head of Data &amp; Analytics Strategy Consulting An established strategy consulting firm is seeking an experienced Head of Data &amp; Analytics to lead their core services team. The organisation prides itself on delivering innovative, data-driven solutions within a collaborative corporate environment. You will be leading managers who are leading teams in Analytics and Data Science. This is a permanent role based in London and is hybrid working. ... ",120000.0,125000.0,https://www.reed.co.uk/jobs/head-of-analytics-data-science/54776676,03/04/2025,data science,England,reed,2025-04-22 18:37:11,Senior,True,True
Principal Data Scientist - NLP,REDTECH RECRUIT,SW100AE,51.485775,-0.180621,"Principal Data Scientist - NLP A brilliant opportunity for a Data &amp; AI specialist with strong NLP knowledge to work in an established AI Research team for a highly prestigious organisation in London, UK. Offering fantastic career progression and the chance to work on cutting-edge projects to help accelerate Machine Learning and Natural Language Processing innovation for the UK Location: London - Hybrid working available - 1 day a week minimu... ",80000.0,110000.0,https://www.reed.co.uk/jobs/principal-data-scientist-nlp/54757627,01/04/2025,data science,England,reed,2025-04-22 18:37:11,Senior,False,True
Senior Ai Engineer,167 Solutions Ltd,WC1A1AP,51.517359,-0.125413,"Senior AI Engineer - Python, AWS, NLP | 100,000 - 130,000 | Remote (UK-Based) 167 Solutions Ltd is hiring on behalf of a global organisation at the forefront of artificial intelligence innovation. We are seeking a highly skilled Senior AI Engineer with expertise in Python, AWS, Natural Language Processing (NLP), and advanced AI technologies to contribute to the development and deployment of cutting-edge AI solutions. Role Overview As a Senior AI... ",100000.0,125000.0,https://www.reed.co.uk/jobs/senior-ai-engineer/54811175,08/04/2025,data science,England,reed,2025-04-22 18:37:11,Senior,True,True
AI Strategy Lead,McGregor Boyall,EC2A2DA,51.521065,-0.080947,"AI Strategy Lead UK &amp; Europe Location: London (Hybrid, 2/3 days in the office) Salary: Up to 110,000 package Start Date: ASAP We are seeking an Innovation &amp; AI Strategy Subject Matter Expert to join a leading financial institution, playing a key role in driving AI adoption and strategic innovation across UK and European operations. This role is ideal for an experienced professional with a strong background in artificial intelligence, AI ... ",100000.0,110000.0,https://www.reed.co.uk/jobs/ai-strategy-lead/54705029,25/03/2025,data science,England,reed,2025-04-22 18:37:11,Senior,True,True
AI Engineer - London,Transparent Technology Ltd,London,51.5074456,-0.1277653,"Full Stack AI Engineer | AI-Powered Innovation | 70k- 100k Benefits Shares| London (Hybrid, 3 days a week) Build the Future of AI-Powered Solutions Are you a Full Stack AI Engineer looking for a role at the cutting edge of AI, Generative Models, and scalable cloud solutions ? Do you thrive in fast-paced environments where your work directly influences the next generation of AI applications? If so, this is the opportunity for you. Why Join? Devel... ",70000.0,100000.0,https://www.reed.co.uk/jobs/ai-engineer-london/54771253,02/04/2025,data science,England,reed,2025-04-22 18:37:11,Unknown,False,True
Founding AI Engineer,SR2,London,51.5074456,-0.1277653,Founding AI Engineer Up to 130k equity London (5 days on-site) Be part of the founding team at an early stage Fintech. Best suited to someone who enjoys building and shipping. Opportunity to build an AI native toolkit from scratch. I’m looking for a Founding AI Engineer to join a very early stage (Pre Seed) startup in London. This role is best suited to people who thrive working in highly ambiguous environments and are happy to pivot at the drop... ,90000.0,130000.0,https://www.reed.co.uk/jobs/founding-ai-engineer/54844497,15/04/2025,data science,England,reed,2025-04-22 18:37:11,Unknown,True,True
AI & Data Solution Consultant,Computappoint,London,51.5074456,-0.1277653,"AI &amp; Data Solution Consultant ?? Ready to Shape the Future with AI? ?? My client, one of the UK's leading and most exciting IT Solutions organisations, is seeking an AI &amp; Data Solution Consultant to lead the charge in transforming businesses through cutting-edge AI and data solutions. Salary: Up to 100k Package: 10% Bonus (discretionary) &amp; Outstanding Employee Benefits&nbsp; Job Type: Permanent Hybrid Model: Mostly remote (ad-hoc to ... ",95000.0,115000.0,https://www.reed.co.uk/jobs/ai-data-solution-consultant/54827123,11/04/2025,data science,England,reed,2025-04-22 18:37:11,Senior,True,True
Data & AI Product Manager,Harnham - Data & Analytics Recruitment,London,51.5074456,-0.1277653,"DATA &amp; AI PRODUCT MANAGER UP TO 120,000 HYBRID - LONDON - 2-3X A WEEK *Please note, this company is unable to offer sponsorship at this time and you must be a UK resident* THE COMPANY Join this professional services firm to take ownership of high-value initiatives, working closely with senior stakeholders and cross-functional teams to deliver impactful solutions. THE ROLE You will act as the key point of contact for stakeholders, including t... ",100000.0,120000.0,https://www.reed.co.uk/jobs/data-ai-product-manager/54626811,11/03/2025,data science,England,reed,2025-04-22 18:37:11,Senior,True,True
Head of Data Science - Credit Risk,Harnham - Data & Analytics Recruitment,London,51.5074456,-0.1277653,"HEAD OF DATA SCIENCE - CREDIT RISK 120,000-140,000 (dependent on experience) London - 3 days in office Great opportunity with a scaling FinTech lender in the UK. This business offer a fast-paced and driven work environment, with a really collaborative team culture that encourages employee development and growth. THE COMPANY This dynamic and fast-paced lender is seeking a driven and experienced individual to join their team to own their modelling... ",120000.0,140000.0,https://www.reed.co.uk/jobs/head-of-data-science-credit-risk/54855160,16/04/2025,data science,England,reed,2025-04-22 18:37:11,Senior,True,True
Lead credit risk data scientist,Harnham - Data & Analytics Recruitment,London,51.5074456,-0.1277653,"LEAD CREDIT RISK DATA SCIENTIST LONDON UP TO 140,000 If you love building models more than managing people, and you're excited by the idea of shaping the future of motor financing-this one's for you. You will be joining as an individual contributor, owning the Data Science function! THE ROLE Build, validate, and deploy credit risk, fraud, collections models Analyse portfolio performance and monitor key risk indicators Collaborate with data engin... ",90000.0,140000.0,https://www.reed.co.uk/jobs/lead-credit-risk-data-scientist/54860037,17/04/2025,data science,England,reed,2025-04-22 18:37:11,Senior,True,True
Rust Engineer - Ai,Understanding Recruitment,EC2M6XB,51.518881,-0.088221,"Rust Engineer - Ai Salary up to 125,000 ( Benefits) London based office - Hybrid Hey, Rust Engineers! Join a dynamic team solving complex problems with highly dynamic Ai enhanced data sets. We are looking for a high-performance Rust Developer to help lead our brand-new Rust project. We're looking for an Engineer with over 8 years of overall software development experience, you should have a solid understanding of database design and a passion fo... ",120000.0,125000.0,https://www.reed.co.uk/jobs/rust-engineer-ai/54771663,02/04/2025,data science,England,reed,2025-04-22 18:37:11,Senior,True,True
"Sales Executive - AI, SaaS",1PGR Services Ltd,SW1Y6BN,51.5072,-0.137387,"Sales Account Executive - AI, SaaS Sector- Technology, Artificial Intelligence, SaaS, Account Manager, Sales, AI Location- Central London with International Travel Salary &amp; Benefits - 30,000 to 40,000 Commission ( 100k achievable) Bonus Phone Laptop Travel Job Type- Sales, Account Manager, Full-time, Permanent, International Sales Account Executive International Travel Opportunities As a Sales Account Executive , you will be involved in sell... ",30000.0,100000.0,https://www.reed.co.uk/jobs/sales-executive-ai-saas/54870376,22/04/2025,data science,England,reed,2025-04-22 18:37:11,Senior,False,True
"Technical AI & Data Portfolio Manager, AI Programme Manager, Remote",Carrington Recruitment Solutions Ltd,W1A1AB,51.514584,-0.152839,"Technical AI &amp; Data Portfolio Manager, AI &amp; Data Programme Manager, Technical AI Delivery Manager, Mainly Remote Data &amp; AI Technical Portfolio Manager (TPM) required to work for a Professional Services business based in Central London. However, this is Global role that may require some Global travel (fully expensed) but most of the work can be done from the comfort of your own home. The TPM is responsible for the strategic oversight ... ",100000.0,120000.0,https://www.reed.co.uk/jobs/technical-ai-data-portfolio-manager-ai-programme-manager-remote/54646974,14/03/2025,data science,England,reed,2025-04-22 18:37:11,Senior,True,True
Head of Data Science Credit Risk & Fraud,Harnham - Data & Analytics Recruitment,London,51.5074456,-0.1277653,"Head of Data Science (Credit Risk &amp; Fraud) Up to 140,000 London Hybrid I am currently hiring for a top consumer lending fintech based in London. They are looking to bring in a top leader in data science function to come into the business and spearhead the Fraud, Credit Risk, and Customer Analytics modelling for the business to support rapid growth. The Role: Developing new models for Credit risk decisioning/developing scorecard models using ... ",120000.0,140000.0,https://www.reed.co.uk/jobs/head-of-data-science-credit-risk-fraud/54860067,17/04/2025,data science,England,reed,2025-04-22 18:37:11,Senior,True,True
