title,company,location,latitude,longitude,description,salary_min,salary_max,redirect_url,created,search_query,search_location,source,date_downloaded,job_level,min_outlier,max_outlier
Python Developer - AI Voice Technology,Understanding Recruitment,London,51.5074456,-0.1277653,"Python Developer - AI Voice Technology Base Salary: Up to 105,000 per annum share options Location: London (Hybrid - 1 day per week in office) We're seeking a highly skilled Python Developer to join our Voice team in London, working on real-time communication, speech recognition, and MLOps infrastructure. This role offers a competitive salary of up to 105,000 per annum, along with stock options, reflecting the critical nature of AI-driven voice ... ",95000.0,105000.0,https://www.reed.co.uk/jobs/python-developer-ai-voice-technology/54509614,20/02/2025,data science,England,reed,2025-04-22 18:37:11,Unknown,True,True
"Data & AI Architect, Microsoft Azure, PaaS, ETL, Data Modelling Remote",Carrington Recruitment Solutions Ltd,W1A1AB,51.514584,-0.152839,"Data &amp; AI Architect, Azure AI Services, PaaS, ETL, Data Modelling, Remote Data &amp; AI Architect / Microsoft Stack / Azure required to work for a fast growing Enterprise business based in Central London. However, this will be a remote role and you may have the odd meeting in London, along with some global travel (all expenses paid). This role will be working at the forefront of AI and we need this candidate to not only have the Data Archite... ",85000.0,95000.0,https://www.reed.co.uk/jobs/data-ai-architect-microsoft-azure-paas-etl-data-modelling-remote/54830126,11/04/2025,data science,England,reed,2025-04-22 18:37:11,Senior,True,False
"Data & AI Architect, Microsoft Azure, PaaS, ETL, Data Modelling Remote",Carrington Recruitment Solutions Ltd,W1A1AB,51.514584,-0.152839,"Data &amp; AI Architect, Azure AI Services, PaaS, ETL, Data Modelling, Remote Data &amp; AI Architect / Microsoft Stack / Azure required to work for a fast growing Enterprise business based in Central London. However, this will be a remote role and you may have the odd meeting in London, along with some global travel (all expenses paid). This role will be working at the forefront of AI and we need this candidate to not only have the Data Archite... ",85000.0,95000.0,https://www.reed.co.uk/jobs/data-ai-architect-microsoft-azure-paas-etl-data-modelling-remote/54795077,06/04/2025,data science,England,reed,2025-04-22 18:37:11,Senior,True,False
Data Engineer,Profile 29,W1S3DN,51.509916,-0.138487,"Job: Data Engineer (London W1) Salary to 95k Benefits; pension, stock options*, free in-office lunches Location; Mon-Fri onsite in London W1 offices (Piccadilly Circus) Company Having recently floated on *NASDAQ, this company is a dynamic, AI-first SaaS company known for leveraging the latest advancements in Generative AI to deliver world-class Ai commerce solutions. Recognized by industry leaders, they are in an exciting growth phase and seekin... ",85000.0,95000.0,https://www.reed.co.uk/jobs/data-engineer/54659709,17/03/2025,data science,England,reed,2025-04-22 18:37:11,Unknown,True,False
Product Manager Data & AI - 12 month FTC,Harnham - Data & Analytics Recruitment,London,51.5074456,-0.1277653,"Product Manager (Data &amp; AI) Location: London (2-3 days per week) Contract: 12-month Fixed Term Salary: 100,000 - 110,000 (up to 120,000) The Company: A leading professional services firm undergoing an ambitious 3-year Data &amp; AI transformation. They are focused on advancing their AI capabilities to enhance business efficiency and improve client outcomes. The Role: As the Technical Product Owner , you'll play a key role in driving impactfu... ",100000.0,120000.0,https://www.reed.co.uk/jobs/product-manager-data-ai-12-month-ftc/54627787,11/03/2025,data science,England,reed,2025-04-22 18:37:11,Senior,True,True
"Solution Architect, Data, AI, Microsoft Azure, PaaS, ETL, Remote",Carrington Recruitment Solutions Ltd,W1A1AB,51.514584,-0.152839,"Solution Architect, Azure AI Services, Data, PaaS, ETL, Data Modelling, Remote Solution Architect / AI / Data / Microsoft Stack / Azure required to work for a fast growing Enterprise business based in Central London. However, this will be a remote role and you may have the odd meeting in London, along with some global travel (all expenses paid). This role will be working at the forefront of AI and we need this candidate to not only have the Data... ",85000.0,95000.0,https://www.reed.co.uk/jobs/solution-architect-data-ai-microsoft-azure-paas-etl-remote/54834927,13/04/2025,data science,England,reed,2025-04-22 18:37:11,Senior,True,False
"Solution Architect, Data, AI, Microsoft Azure, PaaS, ETL, Remote",Carrington Recruitment Solutions Ltd,W1A1AB,51.514584,-0.152839,"Solution Architect, Azure AI Services, Data, PaaS, ETL, Data Modelling, Remote Solution Architect / AI / Data / Microsoft Stack / Azure required to work for a fast growing Enterprise business based in Central London. However, this will be a remote role and you may have the odd meeting in London, along with some global travel (all expenses paid). This role will be working at the forefront of AI and we need this candidate to not only have the Data... ",85000.0,95000.0,https://www.reed.co.uk/jobs/solution-architect-data-ai-microsoft-azure-paas-etl-remote/54834927,13/04/2025,data science,England,reed,2025-04-22 18:37:11,Senior,True,False
Senior Perception Engineer - Spatial AI,Robert Walters,London,51.5074456,-0.1277653,"Our client is at the forefront of redefining the future of construction through pioneering Augmented Reality hardware and software solutions. They are creators of the world's first engineering-grade AR headset, pushing boundaries in spatial computing, cutting-edge optics, AI, SLAM, and computer vision. Their bold goal is to eliminate construction rework entirely by building intelligent AR systems that learn and adapt to the real world automatica... ",100000.0,130000.0,https://www.reed.co.uk/jobs/senior-perception-engineer-spatial-ai/54663433,18/03/2025,data science,England,reed,2025-04-22 18:37:11,Senior,True,True
Lead Data Engineer,Precise Placements ,EC2A4BD,51.52572,-0.084647,"Lead Data Engineer - Shape the Future of Data &amp; Analytics I am currently recruiting for an exciting Lead Data Engineer role with a leading organisation undergoing a major digital transformation . This is a fantastic opportunity to define and lead the data engineering strategy, building a scalable, insight-driven data infrastructure that leverages AI, cloud technologies, and advanced analytics to drive business success. Why Apply? High-Impact... ",90000.0,100000.0,https://www.reed.co.uk/jobs/lead-data-engineer/54549390,27/02/2025,data science,England,reed,2025-04-22 18:37:11,Senior,True,True
Lead Data Engineer,DGH Recruitment,London,51.5074456,-0.1277653,"Lead Data Engineer As a Lead Data Engineer, you'll be instrumental in driving innovation through advanced analytics, AI, cloud technologies, and data science. You will help build a new Data &amp; Analytics function and unified data platform. Key Responsibilities: * Develop and execute a data engineering strategy that aligns with organisational goals and technological advancements. * Design and implement a scalable, reliable, and cost-efficient m... ",90000.0,100000.0,https://www.reed.co.uk/jobs/lead-data-engineer/54777563,03/04/2025,data science,England,reed,2025-04-22 18:37:11,Senior,True,True
Business Development Lead / Project Manager - AI,Harnham - Data & Analytics Recruitment,London,51.5074456,-0.1277653,"Project Manager / Business Development Lead - Urban Transport AI Contract to Perm | 400-500 Per Day | Remote (UK-based preferred) Start: Mid-Late May If you've sold to city authorities, we want to talk to you. My client is building an AI assistant to help councils manage traffic, mobility, and city infrastructure more intelligently. Backed by 1m in research funding and already piloting with major councils, we're now looking for someone to lead c... ",75000.0,100000.0,https://www.reed.co.uk/jobs/business-development-lead-project-manager-ai/54820369,10/04/2025,data science,England,reed,2025-04-22 18:37:11,Senior,False,True
"Senior AI & Data Project Manager, Programme Manager, Mainly Remote",Carrington Recruitment Solutions Ltd,EC2M4YF,51.516887,-0.07834,"Technical AI &amp; Data Senior Project Manager, AI &amp; Data Programme Manager, Technical AI Delivery Manager, AI &amp; Data Portfolio Manager, Mainly Remote Senior Project Manager, AI Programme Manager, Data &amp; AI Technical Portfolio Manager (TPM) required to work for a Professional Services business based in Central London. However, this is Global role that may require some Global travel (fully expensed) but most of the work can be done fr... ",100000.0,120000.0,https://www.reed.co.uk/jobs/senior-ai-data-project-manager-programme-manager-mainly-remote/54861839,17/04/2025,data science,England,reed,2025-04-22 18:37:11,Senior,True,True
"Technical Project Manager, AI, SDLC, Data, Digital, Global, Remote",Carrington Recruitment Solutions Ltd,W1A1AB,51.514584,-0.152839,"Technical Project Manager, AI, SDLC, Data, Digital, Global, Professional Services, PM Certified, Remote Technical Project Manager / Software Delivery Project Manager required to work for a Professional Services business based in Central London. However, this is Global role that may require some Global travel (fully expensed) but most of the work can be done from the comfort of your own home. Please read in full before applying…and you MUST have ... ",80000.0,100000.0,https://www.reed.co.uk/jobs/technical-project-manager-ai-sdlc-data-digital-global-remote/54660734,17/03/2025,data science,England,reed,2025-04-22 18:37:11,Senior,False,True
Principal Data Engineer,IPS Group,Hampshire,51.0449814,-1.2433133,"Role:&nbsp; Principal Data Engineer Type:&nbsp; Permanent Location:&nbsp; Hampshire, London (Hybrid Working) Salary:&nbsp; 80,000 - 90,000 Benefits Are you an experienced Data Engineer ready to take the next step into a strategic, hands-on leadership role? This is a fantastic opportunity to join a well-established organisation with a long-standing heritage and a strong customer-first ethos, operating at scale within the insurance sector. They ar... ",85000.0,95000.0,https://www.reed.co.uk/jobs/principal-data-engineer/54848162,15/04/2025,data science,England,reed,2025-04-22 18:37:11,Senior,True,False
"Technical Portfolio Manager, AI Programme Manager, Remote",Carrington Recruitment Solutions Ltd,W1A1AB,51.514584,-0.152839,"Technical Portfolio Manager, Programme Manager, Technical Delivery Manager, Mainly Remote Technical Portfolio Manager (TPM) required to work for a Professional Services business based in Central London. However, this is Global role that may require some Global travel (fully expensed) but most of the work can be done from the comfort of your own home. The TPM is responsible for the strategic oversight and successful delivery of a portfolio of tec... ",80000.0,110000.0,https://www.reed.co.uk/jobs/technical-portfolio-manager-ai-programme-manager-remote/54795015,06/04/2025,data science,England,reed,2025-04-22 18:37:11,Senior,False,True
"Head of Data - Data Architecture, Strategy/Governance - to £140k +Bonus",Comtecs Ltd,EC1Y8YY,51.52101,-0.090164,"Head of Data - Data Architecture, Data Strategy/Governance, Data Science/Analysis/Engineering; frameworks, data operating model (TOM), compliance, risk, automation; management information (MI) reporting, PowerBI, SQL, ADF, Azure Data Warehousing / Data Lakes. Permanent, London / Hybrid (3/2) 125k - 140k (Negotiable) Bonus Benefits Global organisation seeks Head of Data to lead strategy around data architecture, data governance, platform enhancem... ",125000.0,140000.0,https://www.reed.co.uk/jobs/head-of-data-data-architecture-strategy-governance-to-140k-bonus/54860215,17/04/2025,data science,England,reed,2025-04-22 18:37:11,Senior,True,True
Data Architect,Tenth Revolution Group,London,51.5074456,-0.1277653,My client is based in the London area are currently looking to recruit for an experienced Data Architect to join their team. They are one of the leaders within the consulting space and are currently going through a period of growth and are looking for an experienced Data Architect to join their team. They are backed by a huge Multi National equity firm who are looking to bolster my clients financial position. They are expected to see year on yea... ,90000.0,100000.0,https://www.reed.co.uk/jobs/data-architect/54843263,15/04/2025,data science,England,reed,2025-04-22 18:37:11,Senior,True,True
Data Modeler,Tenth Revolution Group,London,51.5074456,-0.1277653,"My client is based in the London area are currently looking to recruit for an experienced Data Modeler to join their team. They are one of the leaders within the consulting space and are currently going through a period of growth and are looking for an experienced Modeler to join their team. They are backed by a huge Multi National equity firm who are looking to bolster my clients financial position. They are expected to see year on year growth,... ",90000.0,100000.0,https://www.reed.co.uk/jobs/data-modeler/54843309,15/04/2025,data science,England,reed,2025-04-22 18:37:11,Mid-level,True,True
"Senior Business Analyst, Data",Arc IT Recruitment,EC1V0AA,51.523383,-0.100112,"Senior Business Analyst, Data To 85K bonus &amp; benefits London, hybrid Senior Business Analyst is sought by global and highly prestigious insurance group to join its fast-moving and cutting-edge data function. This role sits within a team responsible for driving data-led transformation, delivering scalable solutions and supporting business-wide strategy through insightful analysis and effective stakeholder engagement. This role will see you wo... ",85000.0,85000.0,https://www.reed.co.uk/jobs/senior-business-analyst-data/54760937,01/04/2025,data science,England,reed,2025-04-22 18:37:11,Senior,True,False
"Applied Research SW Engineer AI/ML, Python, C++, Masters/PhD",Hays Specialist Recruitment Limited,Guildford,51.2356068,-0.5732063,"Applied Research Software Engineer (AI/ML, Python/Julia, C , Masters or PhD) Guildford, Surrey (On-site) 65000 - 140,000 25% Bonus, 10% Pension, Private Medical . - A Masters or PhD Degree in Computing or STEM disciplines. - Can work full-time, 5 days a week in Guildford in the office. Your new company This leading Software provider are looking to bolster their engineering team with an experienced Applied Research Software Engineer. You will be ... ",65000.0,140000.0,https://www.reed.co.uk/jobs/applied-research-sw-engineer-ai-ml-python-c-masters-phd/54852395,16/04/2025,data science,England,reed,2025-04-22 18:37:11,Mid-level,False,True
Privacy & Data Associate,Douglas Scott Legal Recruitment ,EC4M9DQ,51.513469,-0.093823,"A top 50 international law firm with a strong presence in London is seeking talented and ambitious Associates with 1 and 4 years PQE to join the growing Cyber and Data Privacy team. In this role, you will provide expert legal advice on data protection, privacy laws, cybersecurity matters, and emerging digital regulations to a diverse clientele, including multinational corporations, technology firms, and financial institutions. Known for its comm... ",97000.0,115000.0,https://www.reed.co.uk/jobs/privacy-data-associate/54857666,17/04/2025,data science,England,reed,2025-04-22 18:37:11,Senior,True,True
Senior Data Architect,Futures Recruitment,York,53.9656578,-1.0743052,"We are looking for an experienced Senior Data Architect to lead data transformation for a leading manufacturing company in York. You will be responsible for designing and implementing a robust data strategy, integrating SAP BW data into a scalable ecosystem. The role focuses on optimising data accessibility, transformation, and analytics to support data-driven decision-making across the business. Key Responsibilities Develop Data Strategy: Desig... ",90000.0,120000.0,https://www.reed.co.uk/jobs/senior-data-architect/54638954,13/03/2025,data science,England,reed,2025-04-22 18:37:11,Senior,True,True
Lead Data Engineer,Tenth Revolution Group,London,51.5074456,-0.1277653,"My client is based in the London area are currently looking to recruit for an experienced Lead Data Engineer to join their Data &amp; AI Consulting team. They are a specialist insurance organisation, that are at the forefront of engineering practices. They are currently going through a period of growth and are looking for an experienced Lead Data Engineer to join their team. They only recruit the &quot;best&quot; talent and have a diverse workfo... ",90000.0,100000.0,https://www.reed.co.uk/jobs/lead-data-engineer/54838346,14/04/2025,data science,England,reed,2025-04-22 18:37:11,Senior,True,True
Lead Data Engineer,Method Resourcing,London,51.5074456,-0.1277653,"Data Engineer | Python | SQL | Azure | ADF | Databricks | Consultancy Lead Data Engineer - Up to 100,000 15% Bonus &amp; Benefits London - Hybrid (2 days in office) Method Resourcing have partnered exclusively with a leading Data Consultancy to hire a Data Engineering Lead to work on a variety of innovative projects. You will be responsible for the delivery of technical projects, and leading a small team of Consultants. As an overview, you can e... ",90000.0,100000.0,https://www.reed.co.uk/jobs/lead-data-engineer/54639978,13/03/2025,data science,England,reed,2025-04-22 18:37:11,Senior,True,True
Senior Data Manager,Page Group,N11AA,51.539746,-0.103053,"Senior leader in data to head up the strategy and development of the data function within a fast grwoth Fintech organisation Client Details The company is a leading global embedded financing platform, trusted by many of the world's top e-commerce sites, tech companies, and payment service providers. Our advanced software platform and APIs empower our partners to offer flexible financing products under their own branding, reaching a broad merchan... ",120000.0,145000.0,https://www.reed.co.uk/jobs/senior-data-manager/54805486,08/04/2025,data science,England,reed,2025-04-22 18:37:11,Senior,True,True
Senior / Lead Fullstack Engineer,Metamindz UK,London,51.5074456,-0.1277653,"Metamindz is a fast-growing UK-based IT software company. We help by providing fractional CTOs as-a-service, building digital products, hiring technical talent, and conducting tech due diligence. We’re looking for a Senior/Lead Full Stack Engineer to join one of our most exciting product partners. This is an early-stage ed-tech company working on a powerful tool to support neurodiverse learners in schools, starting with automated dyslexia and co... ",70000.0,100000.0,https://www.reed.co.uk/jobs/senior-lead-fullstack-engineer/54848191,15/04/2025,data science,England,reed,2025-04-22 18:37:11,Senior,False,True
"Data Design Manager, Azure",Arc IT Recruitment,EC3A5AF,51.514256,-0.078458,"Data Design Manager, Azure London/Hybrid Circa 110k bonus excellent benefits Azure, Databricks &nbsp; Data Design Manager with extensive Azure experience is sought by ever growing insurance group in the City of London.&nbsp; You will be leading the architecture and development of their data platform in Azure and Databricks, as well as defining the data platform strategy and leading a team of Solution Architects. &nbsp;&nbsp; Key Responsibilities... ",110000.0,110000.0,https://www.reed.co.uk/jobs/data-design-manager-azure/54749187,31/03/2025,data science,England,reed,2025-04-22 18:37:11,Senior,True,True
"Lead Data Engineer - AWS - £100,000 - Hybrid - London",Tenth Revolution Group,London,51.5074456,-0.1277653,"Data Engineer - AWS - 100,000 - Hybrid - London Company Overview: My client is a trusted partner for major clients across a range of data-driven industries such as banking, insurance, health-care, retail, and more! With a global presence spanning continents and tens of thousands of professionals, there is no better place to grow and advance your career. Due to their commitment and motivation to stay at the top of their industry, there is constan... ",90000.0,100000.0,https://www.reed.co.uk/jobs/lead-data-engineer-aws-100000-hybrid-london/54856355,17/04/2025,data science,England,reed,2025-04-22 18:37:11,Senior,True,True
Lead ML Engineer / Senior Machine Learning / Remote,MYO Talent,EC1A1BB,51.524502,-0.112088,"Lead / Senior ML Engineer / Machine Learning Engineer / Lead Engineer / Data Pipelines / Data Science / Models / Azure / Python / Pandas / SQL / Software Engineering / DevOps / Developer / Manager / Remote / Home based / Permanent / Salary 80,000 - 110,000 15% bonus benefits. One of our leading clients is looking to recruit a Lead ML Engineer / Lead / Senior ML Engineer. Location - Remote / Home based - may require occasional trip to London Perm... ",80000.0,110000.0,https://www.reed.co.uk/jobs/lead-ml-engineer-senior-machine-learning-remote/54738035,29/03/2025,data science,England,reed,2025-04-22 18:37:11,Senior,False,True
Sr. Machine Learning Engineer Software Engineer ClimateTech,Robert Walters,London,51.5074456,-0.1277653,"Our client is at the forefront of the energy, transport, and industrial sectors' rapid transformation, providing customers with actionable intelligence to compete and win. They combine comprehensive project, funding, and partnership data with expert insights and advanced tools to empower investors, corporates, and governments. They are now seeking a Senior Machine Learning Software Engineer to join their dynamic team. This role offers an excitin... ",120000.0,140000.0,https://www.reed.co.uk/jobs/sr-machine-learning-engineer-software-engineer-climatetech/54841047,14/04/2025,data science,England,reed,2025-04-22 18:37:11,Senior,True,True
Senior Machine Learning Engineer,Robert Walters,London,51.5074456,-0.1277653,"Our client is at the forefront of the energy, transport, and industrial sectors' rapid transformation, providing customers with actionable intelligence to compete and win. They combine comprehensive project, funding, and partnership data with expert insights and advanced tools to empower investors, corporates, and governments. They are now seeking a Senior Machine Learning Software Engineer to join their dynamic team. This role offers an excitin... ",120000.0,140000.0,https://www.reed.co.uk/jobs/senior-machine-learning-engineer/54752759,01/04/2025,data science,England,reed,2025-04-22 18:37:11,Senior,True,True
Senior Machine Learning Engineer,Robert Walters,London,51.5074456,-0.1277653,"Our client is at the forefront of the energy, transport, and industrial sectors' rapid transformation, providing customers with actionable intelligence to compete and win. They combine comprehensive project, funding, and partnership data with expert insights and advanced tools to empower investors, corporates, and governments. They are now seeking a Senior Machine Learning Software Engineer to join their dynamic team. This role offers an excitin... ",120000.0,140000.0,https://www.reed.co.uk/jobs/senior-machine-learning-engineer/54697093,24/03/2025,data science,England,reed,2025-04-22 18:37:11,Senior,True,True
Senior Machine Learning Engineer,Harnham - Data & Analytics Recruitment,Manchester,53.4794892,-2.2451148,"Senior ML Engineer Salary: 100,000- 115,000 equity and bonus Location: Remote within the UK, with biannual global meetups We are partnering with a cryptocurrency analytics firm that helps clients identify market opportunities, perform due diligence, and safeguard portfolios. The company is enhancing its strategic focus on AI and ML. Role and Responsibilities Design and manage AI models to process vast blockchain data sets. Identify key patterns ... ",100000.0,115000.0,https://www.reed.co.uk/jobs/senior-machine-learning-engineer/54630908,12/03/2025,data science,England,reed,2025-04-22 18:37:11,Senior,True,True
Java Engineer,Understanding Recruitment,Basingstoke,51.262826,-1.0861976,"Are you a PhD graduate looking to work with the latest technologies to help individuals embrace greener lifestyles? Core Java Developer - Energy-as-a-Service (PhD) 90k-125k | Remote role In a time when environmental awareness is growing and energy prices are rising, imagine joining a community that helps people adopt greener lifestyles while using advanced technology to keep expenses in check! We are excited to continue our partnership with an i... ",90000.0,125000.0,https://www.reed.co.uk/jobs/java-engineer/54677953,20/03/2025,data science,England,reed,2025-04-22 18:37:11,Graduate,True,True
Engineering Manager,Xpertise Recruitment Ltd,W67NL,51.495616,-0.224255,"Global Leader in Customer Data Science – Engineering Manager Opportunity They are a global leader in Customer Data Science, empowering businesses everywhere to compete and thrive in the modern data-driven economy. Their mission is to enable businesses to grow and reimagine themselves by becoming advocates and champions for their customers. With deep expertise in retail – one of the world’s most competitive markets – they empower businesses acros... ",95000.0,105000.0,https://www.reed.co.uk/jobs/engineering-manager/54733212,28/03/2025,data science,England,reed,2025-04-22 18:37:11,Senior,True,True
Enterprise Architect,Gleeson Recruitment Group,Lichfield,52.6843696,-1.8275286,"ENTERPRISE ARCHITECT (AWS) Hybrid working - 1 day per week in Lichfield Salary Range: 90,000 - 105,000 This brand new role as an Enterprise Architect is pivotal in optimising IT infrastructure and aligning technology strategies with business goals, making it an ideal position for ambitious professionals looking to make a significant impact. This global organisation is looking for an Enterprise Architect who has experience working at a global lev... ",90000.0,105000.0,https://www.reed.co.uk/jobs/enterprise-architect/54662721,18/03/2025,data science,England,reed,2025-04-22 18:37:11,Senior,True,True
