title,company,location,latitude,longitude,description,salary_min,salary_max,redirect_url,created,search_query,search_location,source,date_downloaded,job_level,min_outlier,max_outlier
AWS Technical Architect,Gleeson Recruitment Group,Lichfield,52.6843696,-1.8275286,"AWS TECHNICAL ARCHITECT Hybrid working - 1 day per week in Lichfield This brand new role as a Technical Architect is pivotal in optimising IT infrastructure and aligning technology strategies with business goals, making it an ideal position for ambitious professionals looking to make a significant impact. You would join a small IT team and be comfortable jumping in and working as both the solution and technical architect. The focus for the busin... ",90000.0,105000.0,https://www.reed.co.uk/jobs/aws-technical-architect/54817194,09/04/2025,data science,England,reed,2025-04-22 18:37:11,Senior,True,True
Head of IT,Prospectus IT Recruitment,ST61AJ,53.049,-2.193,Lead IT strategy across hybrid cloud and secure infrastructure. Scale enterprise platforms supporting global financial clients. Join a high-growth SaaS firm with hybrid flexibility and investment backing. Head of IT&nbsp; A market-leading B2B SaaS business operating at the forefront of fraud and financial crime prevention is seeking a Head of IT to lead the next stage of its technology evolution. The organisation powers some of the most critical... ,100000.0,100000.0,https://www.reed.co.uk/jobs/head-of-it/54845284,15/04/2025,data science,England,reed,2025-04-22 18:37:11,Senior,True,True
Senior Software Engineer - High-Performance Sports Technology,McGregor Boyall,Surrey,51.2715316,-0.3414524,"Senior Software Engineer - High-Performance Motorsport Technology Location: Woking, Surrey (Hybrid) Salary: 65K- 95K DOE The Role I'm currently representing a prestigious engineering organization operating at the highest level of competitive motorsport. My client is seeking experienced full-stack engineers with strong .NET expertise to join their software and data science department. This is an exciting opportunity to be part of an ambitious ini... ",80000.0,100000.0,https://www.reed.co.uk/jobs/senior-software-engineer-high-performance-sports-technology/54810874,08/04/2025,data science,England,reed,2025-04-22 18:37:11,Senior,False,True
Senior Fullstack TypeScript Developer (Exposure to GenAI),Avanti,West London,51.532568,-0.4807,"Senior Fullstack TypeScript Developer (Exposure to GenAI) London Paddington - Hybrid ??????? 85k - 105k - Perm Avanti Recruitment is working with an AI Cyber product engineering scale up with multi million dollar Silicon Valley backing. You would join a top 1% company in terms of growth, as well as a team of exceptional Software Developers (Stack is Node.js / TypeScript / AWS) and get exciting exposure to AI technologies across Generative AI and... ",80000.0,105000.0,https://www.reed.co.uk/jobs/senior-fullstack-typescript-developer-exposure-to-genai/54660601,17/03/2025,data science,England,reed,2025-04-22 18:37:11,Senior,False,True
AWS Enterprise / Technical Architect,Gleeson Recruitment Group,Lichfield,52.6843696,-1.8275286,"AWS ENTERPRISE / TECHNICAL ARCHITECT Hybrid working - 1 day per week in Lichfield Salary Range: 90,000 - 105,000 This brand new role as an Enterprise Architect is pivotal in optimising IT infrastructure and aligning technology strategies with business goals, making it an ideal position for ambitious professionals looking to make a significant impact. This global organisation is looking for an Enterprise Architect who has experience working at a ... ",90000.0,105000.0,https://www.reed.co.uk/jobs/aws-enterprise-technical-architect/54797338,07/04/2025,data science,England,reed,2025-04-22 18:37:11,Senior,True,True
Senior Credit Risk Manager - SME Lending,Harnham - Data & Analytics Recruitment,London,51.5074456,-0.1277653,"SENIOR CREDIT RISK MANAGER - SME LENDING 100-120,000 LONDON (3 days p/w) THE COMPANY This is an exciting opportunity with an ambitious FinTech that focus on harnessing data to enhance their lending decisions. This business have been growing in recent years and are now in an excellent position where they are targeting further success across multiple geographies. THE ROLE Developing lending strategies, specifically in acquisitions and ECM, to enha... ",100000.0,120000.0,https://www.reed.co.uk/jobs/senior-credit-risk-manager-sme-lending/54759200,01/04/2025,data science,England,reed,2025-04-22 18:37:11,Senior,True,True
Senior C# Developer .Net AWS - FinTech,Client Server Ltd.,NW11AD,51.528566,-0.131743,"Senior C# Developer / Software Engineer (C# .Net AWS Python) London / WFH to 100k Would you like to join a growing and profitable start-up that is viewed as a leading FinTech disruptor in a senior role that will allow you a great deal of influence and progression? As a Senior C# Developer you will architect and build highly performant and scalable solutions using the Microsoft tech stack and SOLID design principles, collaborating with cross func... ",85000.0,100000.0,https://www.reed.co.uk/jobs/senior-c-developer-net-aws-fintech/54797760,07/04/2025,data science,England,reed,2025-04-22 18:37:11,Senior,True,True
Insights Lead,Sanderson,Bristol,51.4538022,-2.5972985,"Who are Diligenta? Diligenta's vision is to be acknowledged as Best in-class Platform based Life and Pensions Administration Service provider. Customer service is at the heart of everything we do, and our aim is to transform our clients' operations. A business that has been described as 'home' by existing employees, we drive a culture that is founded on positive change and development. Summary of the role: As an Insights Lead, you will play a ke... ",83738.0,83738.0,https://www.reed.co.uk/jobs/insights-lead/54704735,25/03/2025,data science,England,reed,2025-04-22 18:37:11,Senior,True,False
Senior Software Engineer (Hybrid),Avanti,West London,51.532568,-0.4807,"Senior Software Engineer - West London (W2) - Hybrid 2 days per week in the office 80k to 100k DOE Avanti Recruitment is currently partnering with a top 1% growth scale up in the SaaS product world. Their AI Cyber Product has attracted millions of dollars in Silicon Valley investment, whilst the company has built solid foundations and achieved enormous success since starting up in 2020. Are you a solution-oriented Software Developer with a good ... ",80000.0,100000.0,https://www.reed.co.uk/jobs/senior-software-engineer-hybrid/54771452,02/04/2025,data science,England,reed,2025-04-22 18:37:11,Senior,False,True
Chief Information Security Officer - CISO,Teemz Ltd,RG215NB,51.269106,-1.087821,"Chief Information Security Officer - CISO, Up to 160,000 15% Bonus Benefits, 90% Remote Working Included, South East, High Growth Company with double digit growth over the last 5 years Overview of the Chief Information Security Officer: We are seeking a highly experienced and strategic Chief Information Security Officer (CISO) to lead our clients global security strategy and operations. The CISO will be responsible for developing, implementing, ... ",14000.0,160000.0,https://www.reed.co.uk/jobs/chief-information-security-officer-ciso/54859253,17/04/2025,data science,England,reed,2025-04-22 18:37:11,Senior,False,True
Senior Software Engineer (Hybrid),Avanti,West London,51.532568,-0.4807,"Senior Software Engineer - West London (W2) - Hybrid 2 days per week in the office 80k to 100k DOE Avanti Recruitment is currently partnering with a top 1% growth scale up in the SaaS product world. Their AI Cyber Product has attracted millions of dollars in Silicon Valley investment, whilst the company has built solid foundations and achieved enormous success since starting up in 2020. Are you a solution-oriented Software Developer with a good ... ",80000.0,100000.0,https://www.reed.co.uk/jobs/senior-software-engineer-hybrid/54771452,02/04/2025,data science,England,reed,2025-04-22 18:37:11,Senior,False,True
Java Developer - Algorithmic Trading,Client Server Ltd.,EC2V6EE,51.513635,-0.091705,"Java Developer / Backend Software Engineer London to 110k Are you a bright, ambitious Java Developer with a strong knowledge of core Java and an eagerness to learn and progress your career working on complex financial trading systems? You could be joining the Investment Management arm of a global bank. As a Java Developer you will research strategies for tailoring prices and controlling the behaviour of auto-hedging, you'll write production qual... ",80000.0,110000.0,https://www.reed.co.uk/jobs/java-developer-algorithmic-trading/54744160,31/03/2025,data science,England,reed,2025-04-22 18:37:11,Unknown,False,True
Front End Developer TypeScript React - FinTech,Client Server Ltd.,NE16SQ,54.971766,-1.610406,"Front End Developer / Software Engineer (TypeScript React) *Newcastle onsite* to 120k Do you have a first class education combined with commercial TypeScript and React skills? You could be progressing your career at a start-up Investment Management firm that have secure backing and an established Hedge Fund client as a partner, in a role that you can shape and influence. As a Front End Developer you'll take ownership of technical projects, desig... ",90000.0,120000.0,https://www.reed.co.uk/jobs/front-end-developer-typescript-react-fintech/54776325,03/04/2025,data science,England,reed,2025-04-22 18:37:11,Unknown,True,True
Lead Machine Learning Engineer,Rise Technical Recruitment Limited,London,51.5074456,-0.1277653,"Lead ML Engineer London - Hybrid (1 day per week in office) 80,000 - 100,000 DOE Bonus (up to 15%) Excellent Pension Car Scheme Technology Benefits EAP Programme Flexible working This is an incredible opportunity for a Lead ML Engineer to join a fast paced and forward-thinking business always looking to innovate and lead from the front in the technology world. The company are a leading organisation in the energy sector, dedicated to delivering i... ",80000.0,100000.0,https://www.reed.co.uk/jobs/lead-machine-learning-engineer/54745710,31/03/2025,data science,England,reed,2025-04-22 18:37:11,Senior,False,True
Lead Backend Software Engineer Go / Golang,Client Server Ltd.,W1D3QU,51.514654,-0.132846,Lead Backend Software Engineer (Go / Golang) London / WFH to 120k Do you have expertise with backend software engineering combined with Go / Golang coding skills and real-time messaging experience? You could be progressing your career in a hands-on technical leadership role at a global cryptocurrency market data and trade execution technology company that is experiencing great success and is growing as a result. As a Lead Backend Software Engine... ,100000.0,120000.0,https://www.reed.co.uk/jobs/lead-backend-software-engineer-go-golang/54766772,02/04/2025,data science,England,reed,2025-04-22 18:37:11,Senior,True,True
Lead Backend Developer Node - Finance,Client Server Ltd.,W1D7EQ,51.511093,-0.133943,Lead Backend Developer / Engineer (Node API JavaScript CFA) London / WFH to 120k Are you a lead technologist with strong financial services experience combined with Node.js backend development expertise? You could be progressing your career in a hands-on leadership role at a global cryptocurrency market data and trade execution technology company that is experiencing great success and is growing as a result. As a Lead Backend Developer you will ... ,100000.0,120000.0,https://www.reed.co.uk/jobs/lead-backend-developer-node-finance/54765905,02/04/2025,data science,England,reed,2025-04-22 18:37:11,Senior,True,True
TypeScript / React Developer (Full Stack),Ncounter,E140AD,51.510068,-0.015626,"TypeScript / React Developer (Full Stack) Join a pioneering FX and Trading Software technology company that is transforming the global FinTech landscape. With continued international growth and an expanding suite of innovative products, we are seeking TypeScript (React) and Python Full Stack Engineers to join our Market Data Integration division. This is a unique opportunity to shape the future of a flagship platform used by the world’s leading ... ",125000.0,150000.0,https://www.reed.co.uk/jobs/typescript-react-developer-full-stack/54711867,25/03/2025,data science,England,reed,2025-04-22 18:37:11,Unknown,True,True
C# Software Engineer Desktop Trading Systems,Client Server Ltd.,SW71DR,51.5,-0.163,"C# Software Engineer / Developer (Windows Desktop Trading Systems) London to 140k Are you a seasoned Software Engineer with strong C# desktop development skills combined with banking / financial services experience? You could be progressing your career at a Hedge Fund with over $10 billion under management. As a C# Software Engineer you will work on critical systems across front, middle and back office systems to support trading, operations, fin... ",100000.0,140000.0,https://www.reed.co.uk/jobs/c-software-engineer-desktop-trading-systems/54869630,22/04/2025,data science,England,reed,2025-04-22 18:37:11,Unknown,True,True
Senior C# Developer Desktop Trading Systems,Client Server Ltd.,SW71DR,51.5,-0.163,"Senior C# Developer / Software Engineer (Windows Desktop Trading Systems) London to 140k Are you a Senior C# Developer with strong Windows desktop development skills combined with banking / financial services experience? You could be progressing your career at a Hedge Fund with over $10 billion under management. As a Senior C# Developer you will work on critical systems across front, middle and back office systems to support trading, operations,... ",100000.0,140000.0,https://www.reed.co.uk/jobs/senior-c-developer-desktop-trading-systems/54752490,01/04/2025,data science,England,reed,2025-04-22 18:37:11,Senior,True,True
"Scientific Software Engineers C++, Masters or PhD",Hays Specialist Recruitment Limited,Guildford,51.2356068,-0.5732063,"Scientific Software Engineers (C , Masters or PhD) Guildford, Surrey (On-site) 65000 - 120,000 25% Bonus, 10% Pension, Private Medical. - Eligible to work in the UK without Visa Sponsorship.- A Masters or PhD Degree in Engineering, Science, Computing, Geology or Mathematics disciplines. - Can work full-time, 5 days a week in Guildford in the office. Your new company This leading Software provider are looking to bolster their engineering team wit... ",60000.0,120000.0,https://www.reed.co.uk/jobs/scientific-software-engineers-c-masters-or-phd/54837158,14/04/2025,data science,England,reed,2025-04-22 18:37:11,Unknown,False,True
Java Software Engineer - Algorithmic Trading,Client Server Ltd.,EC2V6EE,51.513635,-0.091705,"Java Software Engineer / Developer London to 110k Are you a bright, ambitious Software Engineer with a strong knowledge of core Java and an eagerness to learn and progress your career working on complex financial trading systems? You could be joining the Investment Management arm of a global bank. As a Java Software Engineer you will research strategies for tailoring prices and controlling the behaviour of auto-hedging, you'll write production q... ",80000.0,110000.0,https://www.reed.co.uk/jobs/java-software-engineer-algorithmic-trading/54822314,10/04/2025,data science,England,reed,2025-04-22 18:37:11,Unknown,False,True
Head of Valuations,Harnham - Data & Analytics Recruitment,London,51.5074456,-0.1277653,"HEAD OF VALUATIONS UP TO 130,000 LONDON SPONSERSHIP OFFERED THE COMPANY The company is Fin-Tech aiming to create better solutions for customers money needs. They offer a range of products including, car finance, home improvement loans, credit cards, and savings to name a few. THE ROLE The role is a great opportunity for an experienced credit risk analyst looking to take a step up and have a commercial impact. You will be responsible for developi... ",90000.0,130000.0,https://www.reed.co.uk/jobs/head-of-valuations/54727207,27/03/2025,data science,England,reed,2025-04-22 18:37:11,Senior,True,True
Senior Software Developer C# .Net - FinTech,Client Server Ltd.,NE16SQ,54.971766,-1.610406,"Senior Software Engineer / Developer (C# .Net) *Newcastle onsite* to 130k Are you a Senior Software Engineer looking for an opportunity to progress your career, working on complex and interesting systems in an impactful role? You could be joining a FinTech start-up as a founding member, they have secure backing and an established Hedge Fund client as a partner. As a Senior Software Engineer you will collaborate with a small, talented team to del... ",100000.0,130000.0,https://www.reed.co.uk/jobs/senior-software-developer-c-net-fintech/54827820,11/04/2025,data science,England,reed,2025-04-22 18:37:11,Senior,True,True
Senior Software Engineer C# .Net - relocate to Newcastle!,Client Server Ltd.,EC2V6EE,51.513635,-0.091705,"Senior Software Engineer / Developer (C# .Net) *Newcastle onsite* to 130k Are you a Senior Software Engineer looking to escape the hustle and bustle of London and relocate to somewhere with stunning scenery and a better quality of life (there's also great restaurants and bars!)? You could be joining a rapidly scaling FinTech start-up based in Newcastle, progressing your career and working on complex and interesting systems in an impactful role. ... ",100000.0,130000.0,https://www.reed.co.uk/jobs/senior-software-engineer-c-net-relocate-to-newcastle/54869591,22/04/2025,data science,England,reed,2025-04-22 18:37:11,Senior,True,True
Senior Software Engineer C# .Net - relocate to Newcastle!,Client Server Ltd.,EC2V6EE,51.513635,-0.091705,"Senior Software Engineer / Developer (C# .Net) *Newcastle onsite* to 130k Are you a Senior Software Engineer looking to escape the hustle and bustle of London and relocate to somewhere with stunning scenery and a better quality of life (there's also great restaurants and bars!)? You could be joining a rapidly scaling FinTech start-up based in Newcastle, progressing your career and working on complex and interesting systems in an impactful role. ... ",100000.0,130000.0,https://www.reed.co.uk/jobs/senior-software-engineer-c-net-relocate-to-newcastle/54869591,22/04/2025,data science,England,reed,2025-04-22 18:37:11,Senior,True,True
Machine Learning Engineer,Harnham - Data & Analytics Recruitment,Leeds,53.7974185,-1.5437941,"AI Engineer / ML Engineer - CRYPTO - REMOTE We are collaborating with a cryptocurrency analytics firm that assists clients in identifying market opportunities, conducting due diligence, and protecting portfolios. The company is expanding its strategic capabilities in AI &amp; ML. They are seeking a skilled and driven Senior AI/ML Engineer to join their team. In this position, you will design and manage AI models to process extensive blockchain d... ",100000.0,130000.0,https://www.reed.co.uk/jobs/machine-learning-engineer/54841958,14/04/2025,data science,England,reed,2025-04-22 18:37:11,Senior,True,True
Portfolio Manager - Partner Insight & Performance,Lawes Consulting Group,London,51.5074456,-0.1277653,"Job Title: Portfolio Manager&nbsp; Location: London Full/Part Time: Full Time Salary: 90,000 per annum&nbsp; Purpose of Role: On behalf of our client, we are happy to be able to be working on one of the most exciting propositions in the market. This is an exciting opportunity to work with one of the Top 10 Lloyds Syndicates. Within this role you&nbsp;will support the Senior Manager in effectively engaging and managing the capital partners of the... ",80000.0,100000.0,https://www.reed.co.uk/jobs/portfolio-manager-partner-insight-performance/52461824,12/04/2024,data science,England,reed,2025-04-22 18:37:11,Senior,False,True
Performance Modelling Engineer (CPU),MicroTECH Global Ltd,Cambridge,52.2055314,0.1186637,"You will design, implement, and refine performance models that accurately predict CPU microarchitecture behavior, maintaining in-house toolchains for cycle-accurate, trace-driven, or statistical simulations. Leveraging these models, you will assess the feasibility and cost-benefit trade-offs of new CPU features by conducting in-depth performance and power analyses. This includes developing new methodologies, automating workflows, and creating in... ",149000.0,150000.0,https://www.reed.co.uk/jobs/performance-modelling-engineer-cpu/54674648,19/03/2025,data science,England,reed,2025-04-22 18:37:11,Unknown,True,True
Performance Modelling Engineer (CPU),MicroTECH Global Ltd,Cambridge,52.2055314,0.1186637,"You will design, implement, and refine performance models that accurately predict CPU microarchitecture behavior, maintaining in-house toolchains for cycle-accurate, trace-driven, or statistical simulations. Leveraging these models, you will assess the feasibility and cost-benefit trade-offs of new CPU features by conducting in-depth performance and power analyses. This includes developing new methodologies, automating workflows, and creating in... ",149000.0,150000.0,https://www.reed.co.uk/jobs/performance-modelling-engineer-cpu/54673904,19/03/2025,data science,England,reed,2025-04-22 18:37:11,Unknown,True,True
Full Stack Engineer - Angular 17/.Net 8,Harvey Nash,London,51.5074456,-0.1277653,"Job Title: Full Stack Engineer (C#/.Net and Angular 17) Client: World Leading Commodity Company (Oil and Gas) Salary: 120k base (160k total package) Onsite: 4x per week in London Office Technologies: C# and .NET Core Strong Angular 17 (SSR's is essential) UI/UX development Python Development of services, API's and serverless functions in a cloud environment CI/CD and associated tools Desirable skills and experience Advanced Web development (SSR,... ",100000.0,150000.0,https://www.reed.co.uk/jobs/full-stack-engineer-angular-17-net-8/54689548,21/03/2025,data science,England,reed,2025-04-22 18:37:11,Unknown,True,True
Senior UK Risk Manager - Capital Risk,MERJE Ltd,Wall,40.3936801,-79.7861577,"MERJE is seeking a highly skilled Senior Risk Manager - Capital Risk for a leading institution in the Banking - Commercial sector. This role offers an exciting opportunity to join a dedicated team of 2nd Line of Defence Treasury Risk experts, providing oversight on Capital Risk for a forward-thinking bank with ambitious growth plans. The Company This innovative banking institution powers ideas at every stage of their journey, supporting start-up... ",110000.0,120000.0,https://www.reed.co.uk/jobs/senior-uk-risk-manager-capital-risk/54678394,20/03/2025,data science,England,reed,2025-04-22 18:37:11,Senior,True,True
Lead Software Engineer C# .Net Azure SaaS,Client Server Ltd.,RH29PQ,51.24029,-0.20432,"Lead Software Engineer / Developer (C# .Net Azure SaaS) Reigate / WFH to 100k Are you a backend focussed C# technologist with an indepth knowledge of Azure, combined with technical leadership skills? You could be progressing your career in a senior, hands on role at a global InsurTech business that is producing game changing technology. As a Lead Software Engineer you'll collaborate, problem solve and provide technical leadership to a small team... ",85000.0,100000.0,https://www.reed.co.uk/jobs/lead-software-engineer-c-net-azure-saas/54787214,04/04/2025,data science,England,reed,2025-04-22 18:37:11,Senior,True,True
Chief Information Officer (CIO),Evestigio Ltd,SW1A0AA,51.499839,-0.124663,"Chief Information Officer (CIO) Professional Services CIO - live in your world, but play in ours. Ready for a great Chief Information Officer role? If you are looking to Increase Salary &amp; Responsibility in 2025 - read on. Discussions Basic - range 300k to 330k pa with benefits &amp; remote working. We are looking for a CIO - to help lead a reputed Professional Services Firm. In this CIO role &amp; working closely with the CEO &amp; CISO, you... ",300000.0,330000.0,https://www.reed.co.uk/jobs/chief-information-officer-cio/54777335,03/04/2025,data science,England,reed,2025-04-22 18:37:11,Senior,True,True
Sales Manager,h2 Recruit,EC1A1BB,51.524502,-0.112088,A global leading technology player is looking to add an Enterprise Sales Manager to their business to drive the sales performance of a team of new business hunters selling a revolutionary AI SaaS Legal technology solution to the corporate / Enterprise market The Role: As sales manager your will take responsibility for leading a team (already in place) selling a range of SaaS offerings based around AI and digital transformation for inhouse legal ... ,100000.0,120000.0,https://www.reed.co.uk/jobs/sales-manager/54141597,06/12/2024,data science,England,reed,2025-04-22 18:37:11,Senior,True,True
Senior Product Manager,Digital Waffle ,London,51.5074456,-0.1277653,"Role: Senior Product Manager Location: London (80% Remote) Salary: 85,000 10-15% Bonus Are you passionate about customer value, continuous discovery, and leveraging cutting-edge AI technologies? Do you thrive in fast-paced environments where experimentation and rapid iteration drive success? We are looking for a Senior Product Manager to join our team in London, where you will play a key role in shaping innovative B2B solutions and embedding AI-... ",85000.0,85000.0,https://www.reed.co.uk/jobs/senior-product-manager/54625526,11/03/2025,data science,England,reed,2025-04-22 18:37:11,Senior,True,False
Software Engineer,Better Placed Limited,SE18SW,51.502706,-0.113259,"Software Engineer Up to 120,000 equity Central London -onsite This is a brilliant role for any Software Engineer and AI enthusiast looking to work in a well-funded pre-seed startup. Join a team of 4 experienced engineers with several million dollars in funding (and several years of runway) to help change the way AI agents interface with software applications. You’ll be pivotal in improving their SaaS product and solve some complex AI problems al... ",90000.0,120000.0,https://www.reed.co.uk/jobs/software-engineer/54678352,20/03/2025,data science,England,reed,2025-04-22 18:37:11,Mid-level,True,True
